,titles,category
866,경쟁하듯 대중교통 지원책 통합까지 넘어갈 산은 ,Economy
867, 재난 리스크에 투자 캣본드 투자  지금이 적기 ,Economy
868,  하이닉스   개 분기 연속 적자에서  흑자전환  성공할까,Economy
869,    농협 회장선거   년 만에 직선제  강 구도 격돌,Economy
870,한달은 일쑤   년씩 공백 방치   고치고도 위원  명 동시교체 가능성,Economy
871,연봉  억  년 임기보장  금통위원   익명 에 숨어선 안돼,Economy
872, 줍줍  물량 계속 나오지만  시세보다 비싸다  외면  ,Economy
873, 올해는 다릅니다    게임주  실적 반등에 주가도 오를까,Economy
874,올해 강남 구 분양 쏟아져 절반은  후분양 인 이유,Economy
875,   년 인연 끊으라니  오뚜기 날벼락 중기부에 소송 걸었다,Economy
876,중국 공세에  적과의 동침    삼성  에   패널 쓴다,Economy
877, 서울 옆 동네  새 아파트가 반값   억 로또  줍줍  어디 ,Economy
878, 단독 이재용    명 사장단 불러 튼 영상엔  아이폰보다 아쉽다 ,Economy
879,강남점도 닫는다   저축은행   년 만에 적자  점포 다이어트 ,Economy
880,항셍지수도 급반등했는데 코스피만  꽁꽁  속 터지는 개미들,Economy
881,사모펀드 임원진이 한달간 자사주  억어치 사들인 사연 마켓인 ,Economy
882, 이코노미스트       월  금리 인하 전망 ,Economy
883, 매물    개 거래는  건  새 집도 입주 비상     다시 아파트 거래절벽,Economy
884, 노보 릴리 딱 기다려  제약사들  다이어트약 개발경쟁 불붙었다,Economy
885,조합 시공사  공사비 갈등  정조준  정부  표준공사 계약서 도입,Economy
886,조합이 불붙인 수주경쟁 무이자에 안마의자 등장,Economy
887,펄펄 나는   벌벌 기는    시총 격차  경까지 벌어졌다,Economy
888, 억원 이하 주담대 이자 소득공제 해준다,Economy
889,    손실 투자자들  은행이 내 등에 칼 꽂았다  절규,Economy
890,은행 주담대보다 비싸진 특례보금자리론     조  환승 시작 ,Economy
891, 죽은 동생의 남편이 상속 재산을 요구해요   법률 전문가 조언은 ,Economy
892, 조선 올해 먹거리는 암모니아 운반선 ,Economy
893,첫 삽도 못 뜨고 공사 중단  끝나지 않은  새마을금고    리스크 ,Economy
894,전기차가        사막  죽음의 경주 서  등했다니,Economy
895, 전기차  종 입맛대로   현대차 기아  테슬라 맹추격,Economy
896,홍콩이 인도에 추월당했다    차이나런에       조원 푼다 ,Economy
897,인구 줄어도  인 가구 폭증  서울 살 집이 부족하다,Economy
898,주택연금 소득공제 대상   억에서   억으로 확대,Economy
899, 인구가 없으면 무슨 힘이 생기겠습니까 ,Economy
900, 년 만에 바뀐 생명표     종신보험은  월 이후  연금은  월 전 ,Economy
901, 제  중동붐  타고  현지항공사들  인천 운항횟수 늘린다,Economy
902,주담대  인터넷은행으로 갈아타도 이자상환액 소득공제,Economy
903,건화  사우디 절반 상하수도 설계    추가수주 기대,Economy
904, 수은법 지연에 폴란드   조 무기수출 날릴판  정부 기업 호소,Economy
905,유나이티드발 훈풍에 항공주 일제히 급등,Economy
906,  서  농민 대통령  나오나 송영조 강호동 등  강 구도,Economy
907,회의 한 번에    만원       회 골프   황제 사외이사 ,Economy
908,  년만에 직선제   통령  선거   하루 수백통씩 전화 돌려 ,Economy
909,   무장한      질주   증시 연일 최고치,Economy
910,비트코인      출범 뒤     넘게 폭락    만    달러가 지지선,Economy
911, 위 탈환 노리는  갤럭시        삼성 애플     경쟁  본격화,Economy
912,뉴욕증시  차익실현 압박 속에 혼조세로 출발,Economy
913,  억 성수 트리마제  최고의 투자  김지훈    억 일단 질렀다,Economy
914,숨고르는 뉴욕증시  빅테크 실적 앞두고 장초반 혼조세,Economy
915, 팩트체크    때문에 애플에 반도체 수출 못한다  진실은 ,Economy
916,중국의 흑연 통제  전기차 성장 둔화 배터리 업계  먹구름 ,Economy
917,증권사 오너    세  연이은 지분 확대 경영 승계 시동거나,Economy
918,증류식 소주 재도전하는 롯데칠성음료   대장부  실패 극복할까    초점 ,Economy
919,농협중앙회장 투표       농통령  누가 될까 ,Economy
920, 년 만에 바뀐 생명표     종신보험은  월 이후  연금은  월 전 ,Economy
921, 제  중동붐  타고  현지항공사들  인천 운항횟수 늘린다,Economy
922,주담대  인터넷은행으로 갈아타도 이자상환액 소득공제,Economy
923,건화  사우디 절반 상하수도 설계    추가수주 기대,Economy
924, 수은법 지연에 폴란드   조 무기수출 날릴판  정부 기업 호소,Economy
925,유나이티드발 훈풍에 항공주 일제히 급등,Economy
926,  서  농민 대통령  나오나 송영조 강호동 등  강 구도,Economy
927,회의 한 번에    만원       회 골프   황제 사외이사 ,Economy
928,서문시장  지구 재건축 산 넘어 산,Economy
929,요즘 뜨는 인스파이어 가보니 확 트인 시야  콘서트 핫플  되겠네  현장  ,Economy
930,재무상태표에 안 보이는  우발부채  안전 투자하려면 반드시 확인해야 박동흠의 생활 속 회계이야기 ,Economy
931,신재생에너지 따라 국산 해저케이블 쭉쭉 뻗는다,Economy
932,경제 연착륙 기대감 미 증시 역대 최고치,Economy
933,다시 원전 확대 추세 치솟는 우라늄 가격,Economy
934, 단독   한글 잘 모르는데  은행  외국인에게도 홍콩     팔았다,Economy
935, 총액 만 맞으면 됐던 정비사업 공사비  이젠 세부 내역도 밝혀야,Economy
936, 중국 응원해보기는 처음이네  긴급수혈에 홍콩 지수 간신히 반등,Economy
937,배달 왜 늦나 했더니 배달기사 확보 경쟁에 자영업자 소비자만  골탕 ,Economy
938, 데일리안 오늘뉴스 종합  한동훈  폴더인사 에   어깨  툭  귀경 땐 함께 전용열차로  이재명  이언주에 복당 권유    진지하게 고민하겠다    조합    시공사 갈등 막는다   표준계약서로 공사비 책정 투명화,Economy
939,   억 성수동 아파트     억에 주웠다  김지훈이 밝힌 비결은,Economy
940,너도나도  억대 연봉  받던 곳이 인력 칼바람에  술렁 ,Economy
941, 위대한  인  이끄는  증시 묶여있는     조 풀리면  친 증시 된다,Economy
942,    초과 고도제한 위반 김포아파트 재시공,Economy
943,특정 암세포만 공격  차세대 항암제     개발 경쟁 치열,Economy
944,곳곳 조합 시공사 공사비 분쟁  표준계약서로 막겠다 ,Economy
945,    에 올리기 딱이다    명 중  명이  팝업스토어  방문 경험,Economy
946,또 재건축만 규제 완화  매력  뚝  리모델링 주민들도 돌아선다,Economy
947,펀드매니저     이 뽑은 상반기 포트폴리오는   차전지 호불호  극명  삼성전자는 없다,Economy
948,넷플릭스 실적  가입자와 암호공유 단속 효과가 초점,Economy
949,인공지능 열풍에       유럽 내 시가총액  위로 도약,Economy
950,  억 넘는 성수 트리마제 김지훈     억 주고 샀다  저가매입 배경은,Economy
951,한미약품그룹 통합 반대 가처분  내달  일 첫 법원 심문 종합 ,Economy
952,상업용 부동산 빙하기  천세대 강남 아파트 상가도  텅텅 ,Economy
953,정부 상대로 소송 제기한 오뚜기  왜 ,Economy
954,삼성 차기작 엑시노스       꿈의 칩  기대,Economy
955,추락하는 중국 증시 빠진 돈 움직이자 훈풍  우리는 왜,Economy
956,현물     승인되고     빠졌다 비트코인  만    달러 붕괴,Economy
957, 중국     조원 증시부양자금 고려  보도로 중국주식 반등,Economy
958,인간을 닮아가는     인간을 뛰어넘나  표정 감각 분석은 어려운 기술 ,Economy
959,  조원 폭탄 임박 홍콩 지수 피해 눈덩이,Economy
960, 홍콩     손실 아우성   투자자 책임원칙 고려      원금보전해야 ,Economy
961, 채권단 실사  시작됐지만  임금  밀리고  공사  멈추고,Economy
962, 악성미분양에 장사없다  신축 아파트 결국 통째로 공매 ,Economy
963,양재생  상공계 화합  내세워 도전장 현직의 벽 넘을까,Economy
964, 비곗덩어리  삼겹살에 소비자 분통,Economy
965,서울 주택보급률   년 만에 최저 아파트 용지 연체에 미래 공급도 휘청,Economy
966,중국과  세트메뉴 취급  코스피 인도 일본에만 글로벌자금 몰린다,Economy
967, 만달러 무너진 비트코인 일주일간  만개 내다판  여기  탓이라는데,Economy
968,    가 정기예금 대체상품이라더니    안전성  간판 두른    서민에 사기쳤다 ,Economy
969, 공모주 단골 청약 매매 보고 누락  금감원 거래소 직원 무더기 제재,Economy
970, 소도 잃고  외양간도 못 고쳐   은행     판매 중단해야 ,Economy
971,부진한 어닝 시즌   대 실적 호전 빅테크 기업은  오미주 ,Economy
972,철강시황 부진속 포스코홀딩스 작년 영업익  조 천억원      종합 ,Economy
973,서문시장  지구 재건축 산 넘어 산,Economy
974,한전 직원들 부글부글 임금 반납해서 희망퇴직금 마련 ,Economy
975,홍콩 지수      년     급락  전 저점 근접   대규모 손실 불가피,Economy
976,차익 실현에  비트코인  만달러 붕괴,Economy
977,중앙공원  지구 후분양  선분양  관건은 ,Economy
978, 억원 이하 주택 주담대 이자 소득 공제해준다 산후조리원 공제 급여 요건도 삭제,Economy
979,반도체 뜨고 배터리 주춤      주가 총액  년 만에 시총  위 되찾아,Economy
980, 차전지 소재 철강 사업 부진에 포스코그룹 수익성  뚝  인터는 날개,Economy
981,오뚜기 면사랑  중기부 상대 행정소송 제기,Economy
982,  시대 오자  동학개미 삼전 하이닉스  서학개미는    베팅,Economy
983,임기만료 코앞인데  회장 뽑는 포스코 사외이사들  요지부동 ,Economy
984,단통법 폐지엔 완전자급제 도입  단말기 유통 새판짜기  각양각색 ,Economy
985,실적 하락      주주 배당 확대 약속 지킬까,Economy
986, 홍콩     손실 아우성  손실 눈덩이 홍콩       은행창구서 치매 노인에도 팔았다 ,Economy
987,부동산   로 난리인데  현대건설  해외수주덕 영업익     억,Economy
988,증시도 중국 대신 인도    사상 첫 글로벌 증시 시총  위 등극,Economy
989, 희망퇴직 위해 임금 반납하라  이 회사 직원들  부글부글 ,Economy
990,연봉  천만원 넘어도  산후조리원 공제  자동차 개소세도 깎아준다,Economy
991,삼성   하이닉스 만나는  챗      샘 알트만 무슨 얘기 나눌까 이정주의 질문 ,Economy
992, 대 금융  화재 피해 서천시장 상인들에 금융 지원,Economy
993,상의 역동성 살릴 경쟁은 환영  과열은 우려,Economy
994,금융권  충남 서천특화시장 화재 피해 상인 긴급 지원,Economy
995,주가 하락 원인이 상속세  경제학 뒤집은 모순들  마켓톡톡 ,Economy
996, 정반대로 베팅해 물렸다      억 굴리던 헤지펀드  자존심도 와르르,Economy
997, 단독   불법 리딩방 꼼짝마    잠입 조사  늘리는 금감원,Economy
998,테슬라      자동차 업체도 하소연하는 이 법 왜 ,Economy
999, 비전프로 생성형    변곡점 맞은 메타버스  부활 노린다  메타버스의 명암  하  ,Economy
1000,애 울음소리 절반  뚝   그런데도 유아용품 소비   조    배나 늘어     낳아 기를 여건이 돼야 ,Economy
1001,경기 꺾인      나홀로 추락,Economy
1002,연초부터 천장 뚫는 뉴욕증시     대장주      날개 달았다,Economy
1003,주담대 소득공제 대상  억  소득 상관없이 산후조리비 공제  세법개정 후속 시행령 개정안 ,Economy
1004,김포공항 면세점 입찰 후보에 롯데 신라 선정  관세청 심사로 최종 결론,Economy
1005, 비상금대출이 사라졌다  천덕꾸러기 된 소액대출,Economy
1006,제네시스  해외 비중     돌파  글로벌 명품  입지 다졌다,Economy
1007,석유화학 끝모를 불황 터널    탈석화 가 실적희비 가를듯,Economy
1008,태영   사업장   곳 구조조정 돌입  죄수의 딜레마  시작됐다,Economy
1009,미 일 증시 천장 뚫는데   국내 주식은 하는 게 아니다  ,Economy
1010,    열풍에  다우 첫      선 돌파,Economy
1011,황금알 낳던 사업이 순식간에 고금리 쇼크로  폭망 ,Economy
1012,홍해 리스크로 컨선 운임 급등  해운  위  머스크  부진 탈출하나,Economy
1013,자사주 매입        엔터주에 볕들까,Economy
1014,주담대 갈아타도 이자 소득공제 해준다 대상은 ,Economy
1015,합성형    비중    로 늘었다는데 파킹형 상품 빼면   대 오히려 줄어,Economy
1016,수입차 왕좌는 누구   시리즈와  클래스 한판승부,Economy
1017,증권사도 스팩 상장준비 분주    이달 예비심사 청구  개,Economy
1018, 마켓인    급도 흥행했는데 간신히 회사채 발행액 채운       ,Economy
1019, 통영 굴 맥주  출시 임박   다랑어포 맥주   빵 맥주 도 나온다,Economy
1020,호텔 화장품 화학  추락  차이나 리스크  언제까지,Economy
1021,올해도    시장 활황  대어들 재도전 분위기,Economy
1022,한미사이언스 통합 반대 가처분  내달  일 첫 심문,Economy
1023,주담대 갈아타기로 이자 줄어도  대출 한도 증액 못한다,Economy
1024,천장 뚫은 다우  맥 못추는 코스피  엇갈린 행보            증시  엇갈린 행보  ,Economy
1025, 줬다 뺏나   대형마트 의무휴업 폐지 에 뿔난 소상공인,Economy
1026,부동산   위험노출액        책준 확약에 위기 가중   부동산 아토즈 ,Economy
1027,아르헨티나에  차전지 밸류체인 구축       역량 올인   해외건설  르네상스 ,Economy
1028,   위기에     택지 팔고 못 받은 돈  눈덩이 ,Economy
1029,거래량 받쳐주는 곳 어디  송파 헬리오시티  위,Economy
1030, 연두색 번호판  달아야 법인차 비용처리 다자녀 차 개소세 면세 확대,Economy
1031,다주택 양도세 중과배제  년 더 결혼 출산해도 청년도약계좌 비과세  세법시행령 ,Economy
1032, 반세권  평택 브레인시티      가구 나온다,Economy
1033,집값 하락에 사전청약 무용론 사업취소  도미노  우려,Economy
1034,전기차 수요둔화 강타 포스코퓨처엠 작년 영업이익       ,Economy
1035, 집 계약하면     만원 드립니다  미분양에  초강수  뒀다,Economy
1036, 월  만원대 교통비  기후동행카드  반나절 만에  만    장 팔렸다,Economy
1037,사전청약 당첨 기쁨도 잠시 내집 마련이  희망 고문 ,Economy
1038,전액 무이자부터 고가 안마의자까지  공사비 갈등 무색한 파격 경쟁,Economy
1039,개미 울리는 전환사채  불공정거래 뿌리뽑는다,Economy
1040,다급한    개미 달래기     조 투입  역대급 증시 부양 ,Economy
1041, 미국 국적  배우 마동석 개런티도 세액공제 대상  자녀 셋 같이 안 살아도  개소세 면제,Economy
1042,삼성     상폐 미래에셋     청산 홍콩   파생상품 줄줄이 손실,Economy
1043, 글 못 읽는 노모 가입시켰다  국회서 울분 토한 홍콩     투자자들  가봤어요 ,Economy
1044, 단독      변액보험 도 첫 손실났다  보험사 관리 책임 물 수도 ,Economy
1045,채상욱       대책   공짜 재건축  환상 속  억 조합장만 양산 ,Economy
1046,최진식 회장    상속세는 경영권 다툼 조장하는 악법 ,Economy
1047,  억 잠원 아파트도 당근 할게요  복비 아끼자  직거래 급증,Economy
1048,삼성바이오로직스 직원 절반 이상  괴롭힘 성희롱 당했다   강홍민의 끝까지 간다 ,Economy
1049, 단독      토요 사장단 회의    년 만에 부활,Economy
1050,신한운용   위로 껑충    시장 지각변동,Economy
1051,      근로자 없인 공장 못 돌린다      집단 패닉 ,Economy
1052,김포공항 면세점 입찰 롯데 신라  파전 압축 신세계 현대   고배 ,Economy
1053,  주식 싫다  거절에도 회유하더니      투자자들  울분 ,Economy
1054,   가 기업체질 바꿨다   영업익  배 증가,Economy
1055, 재건축  리모델링       대책으로 현장  대혼란 ,Economy
1056,잃어버린   년 되돌리는 일본   월 금리 인상 힘 실리나,Economy
1057,  반도체 투자땐  혜택 삼성전자 하이닉스 시장공략 힘보탠다,Economy
1058,지금 안들면 손해   쏟아지는 한정판 보험,Economy
1059,  이 이끄는  증시 엔저 덕보는  증시   연일 최고치 활활,Economy
1060,이복현 금감원도  사후약방문  선례 있는데도     사태 못 막은 이유는,Economy
1061, 단독  우량 부동산   신규자금 찬성한 대주단에 인센티브 준다,Economy
1062,완전 자회사 편입하나 미래에셋운용  생명지분   만주 추가 매입,Economy
1063,이리 뒤척  저리 뒤척 잠 못 자는 한국인   꿀잠 에 돈 얼마나 쓰나,Economy
1064,   년 인연 단칼에 끊으라니   오뚜기  정부에 소송 건 사연,Economy
1065,하림     인수 걸림돌 된  경영 주도권   변수 커졌다 ,Economy
1066,친환경 선박 연료      대신 메탄올이 대세,Economy
1067,티맥스그룹  티맥스소프트 재인수 추진  조 확보  관건 ,Economy
1068,금융지주 올 영구채 첫 타자 신한 수요예측  배 몰려,Economy
1069,   전환가     넘게 내릴 때  주총 승인  의무화,Economy
1070, 내가 죽으면 아들이    억을 어찌 마련할지 막막합니다 ,Economy
1071,이번엔 일낸다 삼성 엑시노스 재출격,Economy
1072, 상속가업 업종변경 자유롭게    상속세 개편은  속도조절 ,Economy
1073,대출 의존도 낮춰 연쇄부실 차단  공급절벽 대책 병행해야 ,Economy
1074, 주담대  이자부담 내리고 다주택자 양도세 중과 유예,Economy
1075, 삼성    중 누구 손 잡을까     챗    아버지 올트먼 방한,Economy
1076,은행 대출 조이기  풍선효과  보험사 약관 신용대출 급증,Economy
1077,    사태 놀란 은행  원금보장 상품 확대 ,Economy
1078,중학개미  더는 못참아  올 들어     억 뺐다,Economy
1079, 주 연장한     인수 협상    대 변수는,Economy
1080, 주담대 금리      나 낮췄어요   환승  잡으려 금리인하 경쟁,Economy
1081,   흑연 없다    수출 통제에 전기차 둔화까지  배터리주에 시련,Economy
1082, 보험 비교 추천 서비스  보기는 편한데  그래서 보험료 싼 곳은 어디  ,Economy
1083,    기업인 위기극복 능력 믿는다 ,Economy
1084, 생생플러스  여야 저출산 대책 총정리   효과  위는  억 주고 출산시 탕감,Economy
1085, 유통법 개정 안되면 지자체라도   새벽배송  공들이는 마트,Economy
1086,아시아나  기내식 대금 소송  년 만에 종결    억원 이상 물어줄 듯,Economy
1087, 종이가 사양산업이라고  친환경 물결에 책장 넘기는 중   이사람 ,Economy
1088,연일 맥 못추는 비트코인   일만에  만달러 밑으로,Economy
1089,   세에게  지수     권유   은행서 위험 성향 조작   쏟아진 성토,Economy
1090,동학개미 울리는 전환사채 발행 공시  고무줄 전환가액 손본다,Economy
1091,역대급 랠리 개미들   반도체     너는 나의 봄 ,Economy
1092,너도나도      무슨 일   슬기로운 금융생활 ,Economy
1093,엇갈리는     증시 미 증시 시총  중화권보다   경  ,Economy
1094, 관광객  이탈리아서 인종차별 폭행 당해  외교부   미온적 대응  주장 사실 아냐 ,Economy
1095,스트레스    도입 눈앞  변동형  고정형 유불리 달라요 ,Economy
1096,    는 착시    합성    가 퇴보하는 이유,Economy
1097, 상장 철회  대어들 돌아올까   공모금액  조 몰린다,Economy
1098,두자릿수 수익률에 거래도 북적   부럽네  일본 반도체     ,Economy
1099,연초부터 대기줄 길다   스팩 상장준비  북적 ,Economy
1100,단통법 폐지에 시장 술렁  단말기 가격 내려갈까 ,Economy
1101, 인민개미  살리기 나선 중국       조 증시부양 추진   마켓플러스 ,Economy
1102, 애플 비전프로 잘 팔리네  메타버스 부활 신호탄되나,Economy
1103,하나   금융  충남 서천시장 화재 피해 상인에 대출 지원,Economy
1104, 오픈     샘 올트먼 방한   협력 소식에 반도체   들썩  핫종목 ,Economy
1105,포스코퓨처엠 작년 영업이익        전기차 수요둔화 여파 종합 보 ,Economy
1106, 자기자본     로  부동산   대수술,Economy
1107,짝퉁 지뢰밭된  직구   삼성 이어폰 카카오 키링까지,Economy
1108,   넥스원의 무인수상정      출격 중동  방산 한류  노린다,Economy
1109,머나먼 내집 마련   서울 주택보급률   년만에 최저,Economy
1110,대형마트 의무휴업일 규제 폐지되나   이마트  쿠팡과  진검승부  펼친다,Economy
1111,짝퉁 귀걸이 털자  발암물질  범벅 기준치    배 넘어,Economy
1112,석화업계 불황에   화학 실적 위축 신산업   조 투자로 기지개 켤까,Economy
1113, 주담대 갈아타기 도 이자 소득공제 집값 기준  억  억으로 올려,Economy
1114,전기차 둔화에 포스코퓨처엠  작년 영업이익  분의  로 감소,Economy
1115,미래 기술 리더된   기업들  보안  핵심가치 부상,Economy
1116,아시아나  밀린 기내식 대금    억 지급 확정 항소 포기,Economy
1117,     후폭풍 대치  응봉대림  리모델링 파열음,Economy
1118,착공 후라도 물가변동 반영   조합 시공사 공사비 분쟁 예방 ,Economy
1119,전기차 보조금 개편에 국내 중소업체  비상   존폐 위기 ,Economy
1120,월배당     질주  순자산  조 첫 돌파,Economy
1121, 억 소리  고가 자동차  지난해 최다 판매 기록 썼다,Economy
1122,     억 부천 땅 매각 확정 아냐  태영건설 공시,Economy
1123,주담대 고정금리 다시 뛴다    금리 인하 기대감 선반영 탓 ,Economy
1124, 롯데  신라  최종후보 선정 김포공항 면세입찰  관세청 심사만 남았다,Economy
1125,  그룹   년 만에    제치고 시총  위 복귀 하이닉스 선전,Economy
1126, 하노이의 기적  이룬 롯데쇼핑   복합쇼핑몰 로 역성장 고리 끊어낼까,Economy
1127,마트보다 식당 맥주값 더 올랐다   년 만에 최고 수준,Economy
1128, 마켓인 만기 비우량채   조 상환 어쩌나 기업들 조달 놓고 고심,Economy
1129,캄스퀘어안산데이터센터    구조 고도화 대행계약 체결 자본금 증자 및 본   시동,Economy
1130, 연봉  억에도 구인 어려워  몸값 치솟는    전문가,Economy
1131, 남들 오를 때 왜 안 올라  코스피  미워도 다시한번 왜 ,Economy
1132,보잉    맥스  날개 꺾인 유나이티드항공   분기 손실 ,Economy
1133,롯데건설     조 펀드로 유동성 숨통 텄지만   ,Economy
1134,전기차 불황에 포스코퓨처엠 이익  뚝  인터는  조 돌파,Economy
1135,  의 거짓  흥행 네오위즈  후속작 없어 주가 반등 힘겹네,Economy
1136,아파트도 살만해야  살맛 도 나지 요즘 뜨는  완성형 도시  알아보니,Economy
1137,미 중 증시 온도차 한국 증시   냉탕 중화권  따라가나,Economy
1138,이복현  부실   빨리 정리  재차 경고 후순위 채권단 동의 관건,Economy
1139, 반나절 만에 동났다    서울 대중교통 정기권 첫날 인기 몰이,Economy
1140,대형마트  새벽배송  족쇄 풀리나 무한경쟁 앞둔  이마롯쿠 ,Economy
1141,대형마트  새벽배송 은  커머스 지도를 바꿀수 있을까,Economy
1142,포스코퓨처엠도  어닝쇼크  지난해  분기 영업손실,Economy
1143,곳곳서 터지는 공사비 갈등에  국토부   표준계약서  도입한다,Economy
1144,아시아나     에    억 물어야   기내식 대금 소송  년만에 종결,Economy
1145, 서 몸집만 키운  알리익스프레스 짝퉁 논란  현재진행형 ,Economy
1146, 경기침체  올테면 와봐  끄떡없는 방탄종목     올랐다,Economy
1147,갤럭시링  애플링  반지의 제왕은 치열해진 디지털 헬스케어 시장,Economy
1148, 보험사 경영분석  흥국생명  자본시장 오해 풀었지만 인정 못 받는  연금저축  성과,Economy
1149, 집벽에   억짜리 그림이 척      억 넘게 팔린 이우환 작품 가격 봤더니  투자    ,Economy
1150,정부 부양책에도 떨어지기만 하는   증시 이유는   법 개정 안 됐고 기업 실적도 나빠 ,Economy
1151, 단독  전기차 신공장에  조 쏟는데 현대차도   세혜택 우선순위 밀린다,Economy
1152, 호갱님 의 부활  단통법 폐지의 두 얼굴,Economy
1153, 단독  고정금리 주담대  적으면 예보료 최대    더 내라 은행권  당혹 ,Economy
1154,조합 시공사 공사비 분쟁 막을까 국토부 표준계약서 배포,Economy
1155,가스공사   정부 수소사업  전면 축소,Economy
1156,대형마트의    년 숙원  이번엔 진짜 풀릴까,Economy
