,titles,category
280,김경률 겨냥한  친윤   김건희 앙투아네트  마녀사냥 하는 모습 자제해야 ,Politics
281,이상민  한동훈 사퇴요구 논란에  대통령 비서실장이 책임져야 ,Politics
282, 속보    공관위  여론조사  위 후보 지지율이  위 두배 이상이면 단수 공천 ,Politics
283,임혁백 공관위  이재명 사법리스크 돈봉투 의원에 벌써부터 관대 ,Politics
284,여당 탈당 이언주  돌고 돌아 다시 민주당으로,Politics
285,여   회 연속 패배 지역에 전략공천 서울 마포을 등 해당 종합 ,Politics
286,윤 대통령  여권 장악력  훼손 한동훈  홀로서기  일부 성과,Politics
287,국민의힘  지지율 월등히 높으면  단수공천  불출마 컷오프 지역은  우선공천 ,Politics
288,이준석  윤 대통령    한동훈   차전 한동훈 우세승    차전 있을듯 ,Politics
289,불씨 안고  윤 한 충돌  일단 봉합,Politics
290,민주  피해 상인은 안 만나   윤석열 한동훈 정치쇼 ,Politics
291,국민의힘 공관위   회 연속 패배 지역은 전략 공천 ,Politics
292, 정면승부  송영훈    한  오해 풀 정도 소통 있었을 것  성치훈  이틀만에 수습되지,Politics
293, 불구경 왔나  윤석열 한동훈  화해 배경 으로 쓰인 화재 현장   김은지의 뉴스   ,Politics
294,윤  같이 가자  한  깊은 존중  총선 공멸 위기감에 서둘러 손잡아,Politics
295,국힘  경선서  회 이상 경고시 후보자 자격 박탈 현역 컷오프 지역 우선추천,Politics
296,국민의힘 공관위   여론조사 지지율  배 차이 나면 단수 공천 ,Politics
297, 공관위   연속 패배 지역 전략공천    김경율 거론된 마포을도 해당,Politics
298,고민정      어깨 툭 으로 끝    대통령 멱살  한동훈  뭘 하든 바지사장 될 것  여의도초대석 ,Politics
299, 예상 못한 만남  이례적 생중계 화해 수습에 적극적  왜 ,Politics
300,  공관위  부산 해운대갑 인천 계양을 서울 마포을 전략 공천,Politics
301,여 공관위   회 이상 경고시 경선 후보 자격 박탈키로,Politics
302,일정 당겨 내려갔다 올라올 땐  깜짝 동승   꼬인 것들 풀렸다 ,Politics
303, 뉴스라운지  윤석열 만난 한동훈  신뢰 변함 없어    갈등 봉합 수순 ,Politics
304, 여랑야랑 윤 한 충돌  실전같은 약속대련    홍익표  인신공격 말라 ,Politics
305,안철수  김건희 명품백 논란에  진정 어린 입장 표명 필요  사과 거듭 주장,Politics
306,김경율  비대위 사퇴  또는  불출마  하면 갈등 봉합 ,Politics
307, 자막뉴스     온대서 기다렸는데 당했다    울분 토한 서천 상인들,Politics
308, 공관위원장  후보간 인신공격 엄격 조처  계파 과열경쟁 경고 종합 ,Politics
309,대통령실  서천 상인 분노에 해명  상인    명 만나 위로 ,Politics
310,친윤  김경율  비대위원 사퇴해야     사퇴 생각 없다 ,Politics
311,이낙연 신당 미래대연합 우선 합칠 듯,Politics
312,김은혜 김병욱    기 신도시 특별법  신경전  국민은 두 번 속지 않아      속기록 보고 오라 ,Politics
313, 격전지 속으로  보수세 확산이냐 저지냐  민심 가늠자  강동갑,Politics
314, 영상   한동훈       티셔츠 꽃게 제스쳐로 유난 떨더니 결국 반공 올드보이  ,Politics
315,이준석   차 약속대련은 한동훈 우세승    차전 있을 것 ,Politics
316, 아는기자 갈등 봉합 위한 대통령실의  두 가지 조건  ,Politics
317,민주당 공천 갈등은 현재진행형  수박 이어 멜론도 나가라 ,Politics
318, 친명  양이원영  비명 양기대에 도전장 민주  자객 출마  논란 지속,Politics
319,김경율   마리 앙투아네트  발언  김건희 여사와 비교 아냐 ,Politics
320, 뉴스추적  윤석열 한동훈 갈등 봉합 국면 관건은 김경율 거취,Politics
321, 아는기자 한동훈  윤 대통령에    도 인사 ,Politics
322,윤 대통령  참모진 설득에  한동훈 만나겠다 ,Politics
323,현역 출마 공약 러시  대전 정치권 총선 레이스 분주,Politics
324,친명  비명 지역구 잇단 출사표   집안싸움 위험 수위,Politics
325,또 비명 저격 출마 선언 과열 경쟁 우려에 홍익표  경쟁자 존중을 ,Politics
326,윤  같이 타자  한  자리 있습니까  열차 동승해 서울로,Politics
327,방심위      바이든 날리면  보도 재심의,Politics
328, 대통령 취임 후 국민의힘  원톱   번 교체    년지기 한동훈은   이슈  ,Politics
329,   사진만 찍고 갔다  항의 소동에  허은아    어깨 두드리며 상인 눈물 외면 ,Politics
330,대통령실 한동훈 갈등 수습 봉합 국면,Politics
331,김은혜  재건축이 국민 삶 망가뜨린다는 민주당 발상 김병욱  분당 주민 앞서 당부터 설득해야 ,Politics
332,민주당 공관위  국회의원 입후보자 간 인신공격 엄격히 조처 ,Politics
333,국방위원장   우리 북한 에     은  옆집 돌   이재명 망언  비참한 안보관 ,Politics
334,눈 맞으며   기다린 한동훈   폴더 인사 로 갈등 봉합,Politics
335,                응집력 급격히 약화된 친윤  홍위병 ,Politics
336,여야 원로들  당정  국민에 안정감 줘야  갈등만 거듭하면 무책임  지적,Politics
337,먼저 온 한동훈   에   도 인사 공멸 위기감에  극적인 봉합   당정 갈등 일단락 ,Politics
338, 명품백 의혹  사태 공개 사과는 없을 듯  제 부속실 설치 규모 시기 등 놓고 고심  당정 갈등 일단락 ,Politics
339,     도 인사 하자     어깨 툭  쳐  민생 얘기만 주고 받았다 ,Politics
340, 이재명이 제안  이언주  탈당  일만에 민주당 복당  고심 ,Politics
341, 이낙연 신당 에 싸늘한 호남  지대 광주 출마 압박,Politics
342,잿더미 바라보며 갈등 불끄기  어디 장소가 없어서  비판도,Politics
343,한동훈    존중 신뢰 변함없다    민생 고리로 파국 피했다,Politics
344,공지영  조국에 실망했다  하태경  진심으로 응원한다 ,Politics
345, 국정 기조 안 바꾸면 대통령도 불행해진다 ,Politics
346,트럼프 헤일리  양자구도 첫 대결,Politics
347,민주당  잿더미 된 시장을  브로맨스 화해쇼  배경으로 삼나 ,Politics
348,이재명  대장동 재판  출석했다 몸 상태 악화로 오후 퇴정 종합 ,Politics
349,  정청래  예비후보  명 후원회장  시끌   친명 또  자객 출마 ,Politics
350,보수논객마저 쓴소리    잿더미서 윤석열 한동훈 화해연극  ,Politics
351,   한동훈 만남이 주목적    일부 상인들  아무말 없이 갔다  분통,Politics
352,윤 대통령  장악력  훼손 윤 한 충돌 봉합의 정치적 후과는 ,Politics
353,이재명    일 만에 열린 대장동 재판서 중도 퇴정,Politics
354,     도 숙여 인사     어깨 툭 치며 악수,Politics
355,윤 대통령  열차 같이 탑시다     대통령 존중  일단 갈등 봉합,Politics
356, 윤석열 당선  등 공신 은 추미애인데      키운 임종석 노영민 석고대죄하라 ,Politics
357,    강성희 강퇴 진상규명  운영위 단독소집    불참에 파행,Politics
358, 파워게임       한동훈   조기 봉합  수순 뇌관은 여전 정다운의 뉴스톡 ,Politics
359, 함께 한 추억  특검 점퍼 입은     한동훈    도 인사 ,Politics
360, 영상   결혼 안 하고  애도 키워보지 않고 헛소리 남발  이준석 직격한 노인회장에 이병태 교수  정말 꼰대들의 막말 ,Politics
361,법무부 장관에 박성재 윤 대통령 대구 좌천 때 고검장,Politics
362,노영민  더이상 분열은 안 돼  총선 불출마 압박 일축,Politics
363,한 총리  전재산 기부  고 신언임 여사에  따뜻한 미소 오래 기억하리 ,Politics
364, 팩트체크  홍익표  원전 사용 반도체 해외 못팔아   애플은 원전도 가능,Politics
365,손잡거나 발목 잡거나 부산 여 현역 구청장 시너지  극과 극 ,Politics
366,문제는  국민 눈높이   당 용산  완전한 원팀  시간 걸릴 듯,Politics
367,민주 최고위원 정청래  후원회장 맡아  시끌  공천 계파 갈등 격화,Politics
368, 확전  피했지만  대통령 한동훈 화해 바라보는 두 시선,Politics
369,미래대연합   이낙연 신당  새로운미래와 이르면 이번 주 통합,Politics
370, 르포       정치적 말 대신 열차 동승으로  봉합  메시지,Politics
371,한동훈  열차에 자리 있습니까  윤석열  같이 올라가자 ,Politics
372, 화재 현장 따로 가면 이상해        회의 도중 한동훈과 만남 결정,Politics
373,금태섭 신당  노인 무임승차제 유지 확장   폐지  이준석과 입장차,Politics
374, 연합뉴스 이 시각 헤드라인         ,Politics
375,윤 한  깜짝 회동  막전막후 한 방문 소식에 윤 시간 앞당겨,Politics
376, 김건희 리스크 사천 논란    갈등 뇌관은 그대로,Politics
377,서천시장 일부 상인    사진만 찍고 가  항의 야권  현장 쇼통으로 복장만 터져 ,Politics
378,   시장 화재 현장은    한동훈  정치쇼 무대 아냐 ,Politics
379,갈등 노출 이틀 만에 조우   한동훈  신뢰 변함 없어 ,Politics
380,   열차 같이 탑시다    동승 화답     년 인연  파국 피했다,Politics
381,올  월부터   개월 복무 병사도 예비역 부사관 임용 가능,Politics
382,  저격수  변신한 이언주  년만에 민주당 귀환하나,Politics
383, 강성희 사태  끝까지 간다는 민주당   대통령 사과하라 ,Politics
384,제 지대 흐지부지될라    말 초가 통합 데드라인 ,Politics
385,김경율 비대위원    가 만만합니까  지역 정치권 성토 한목소리,Politics
386,  리포트  이준석  윤 한 갈등   같은 중국집  이론 불식 의도 ,Politics
387, 일만에 봉합된     갈등  공천권  등 이견 좁힐까,Politics
388,박지원  이낙연  호남  석도    한동훈  갈등 봉합  이준석     차전  이재명  이언주 복당 권유,Politics
389,   눈바람 맞으며    도 인사     어깨 툭치며 손 내밀어,Politics
390, 언제든 다시 터질 시한폭탄  용산  명품백 논란  해법 고심,Politics
391, 선거 지면 돌아갈 곳 없다  한동훈 배수진,Politics
392,박지원의 예언  한동훈  결국 항복하고  용핵관  대거 공천할 것 ,Politics
393,총선 앞 현실론에 갈등 봉합한      대통령님에 대해 깊은 존중과 신뢰 ,Politics
394, 대통령에 깊은 존중과 신뢰   김경율   명품백   물었더니   현장영상 ,Politics
395,   아침회의서  한동훈 서천 온다  보고 받고 흔쾌히  가자 ,Politics
396, 윤 한 갈등  봉합 수순 한  깊은 존중과 신뢰 변함 없어  종합 ,Politics
397, 탈당만 세 번  이언주 전 의원  돌고돌아 민주당 재입당할 듯,Politics
398,이재명  이언주에 복당 권유    진지하게 고민하겠다 ,Politics
399,윤 대통령  한 위원장 어깨  툭  미소  이틀 만에  화해 모드 ,Politics
400,조응천  친명 원외  수박 나가니까 친문 이해찬계도 나가라고 압박 ,Politics
401,서로 일정 조절한       도 인사에 상경열차도 동승,Politics
402,윤석열 한동훈  서천화재 공동 대처  갈등 불씨는 남아,Politics
403, 강성희 퇴장  국회 운영위 파행    경호법 위반       사과하라 ,Politics
404, 한동훈도 서천 온답니다    현장 방문 계획하던  과 통했다,Politics
405,한동훈이 여당 내 야당        갈등 봉합에도 불안한  ,Politics
406, 국힘 탈당  이언주에 이재명 복당 권유    고민하겠다 ,Politics
407,한동훈  대통령 깊은 존중 신뢰 변함없어   김건희 명품백 엔 침묵,Politics
408,비명 지역구 노리는 친명 비례 의원들    선명성  경쟁 조짐,Politics
409,이언주  이재명 복당 제안에 고심중 ,Politics
410, 단독   문재인 대통령의 입  강민석 전 청와대 대변인  민주당 입당,Politics
411,윤 대통령과 한동훈  정치적 갈등일까  인간적 손절일까  중립기어 라이브 ,Politics
412,민주  사천이든 공천이든 대통령실  총선 개입 ,Politics
413,김주영  지역 숙원 인하대병원 설립 논의   대학 측 설립 의지 확고 ,Politics
414, 외식비 줄이지 애들 공부시킬 돈은 안 줄여  민주로 간  전직 현대차 사장 의 비판,Politics
415, 분열은 공멸  공감대  갈등봉합 나선 당정  해법은 숙제,Politics
416,민주당  선거제  변심에 정의당  가시밭길 예고,Politics
417,갈등 봉합  윤 대통령 만난 한동훈  민생 얘기만 했다 ,Politics
418, 국회 우습나    분만에 끝난  강성희 강제 퇴장  운영위  여심야심 ,Politics
419,야권  화재 현장을 화해 현장 활용  공격,Politics
420,이재명   윤 정부 저격  이언주에 복당 권유    고민하겠다 ,Politics
421,  한동훈 충돌 봉합    김건희 성역화  되레 강화됐다,Politics
422, 국힘 탈당  이언주에게 손 내민 이재명  외연 확장 일환 ,Politics
423, 김건희 리스크 가 삼켜버린 대통령 신년 기자회견,Politics
424,  정부 저격수  이언주   년 만에 민주당 복당하나,Politics
425, 당권 재편기 에 또 등장한  윤심 압박   버텨낸 한동훈의 동력은 이런정치 ,Politics
426,금태섭  윤석열 한동훈 같은 뿌리 곧 봉합  이상민  이관섭 책임져야 ,Politics
427,비명 지역구 노리는 친명  이수진 양이원영 등 속속 도전장,Politics
428,이준석  개혁신당  인재영입위원장  겸임,Politics
429, 영상  민주당  대통령 당무 개입 사실  한동훈 위원장 본인 입으로 확인 ,Politics
430, 사사건건 플러스  천하람  지하철 없는 지역 고령층도 살펴야 통합 자체가 목표 아냐 ,Politics
431,정영환 공관위원장  줄세우기 공천 계파 공천 구태 끊어내겠다 ,Politics
432,추미애  윤석열 키운 임종석 노영민 석고대죄해야 ,Politics
433,친명계  비명계 지역구 잇단 도전장  공천 계파갈등 격화,Politics
434, 정치사색  윤대통령 한동훈 서천화재 공동 행보 갈등 봉합 분기점 맞나,Politics
435,새로운미래 미래대연합   정치개혁  고리로 야당발 신당 통합 시동,Politics
436,녹색 정의 연합정당  월  일 창당  사이비 제 세력과 달라 ,Politics
437,김근식  김건희  교통사고 피해자지만 차도냐 인도냐  따질 부분은 있어 ,Politics
438,이재명  국민의힘 탈당 이언주에 복당 권유  늦지 않게 결론 내릴 것 ,Politics
439,정의당  녹색당과 선거연합정당 공식화 제 지대와도 차별화 공언,Politics
440,한동훈  윤에 깊은 존중과 신뢰 마음 가져 변함 전혀 없어 ,Politics
441,한동훈  웃으며   도 폴더인사     악수 뒤  어깨 툭 ,Politics
442,김병욱  노후도시특별법 민주당 주도  김은혜 속기록 보고 오라 ,Politics
443, 선 노리는 주호영에  다선 피로감  공격하는 예비후보들 수성구갑       총선 격전지 속으로 ,Politics
444,안형환 전 의원  송파갑 출마  윤석열 정부 성공 뒷받침 ,Politics
445, 관광객  서 괴한 습격 외교부  미온적 대응  주장 부인 종합 ,Politics
446, 무기 거래  증거 없다 는 러 대사에 외교부  즉각 중단 강력 촉구 ,Politics
447,갈등 논란 후 첫 대면   한동훈  조기 봉합수순 돌입,Politics
448, 현장연결  한동훈  서천 화재 방문후 상경 취재진 질의응답,Politics
449, 현장영상   한동훈   대통령에 대해 존중 신뢰 마음   변함 없어 ,Politics
450, 뉴스큐  신평  한동훈  과도한 대선 행보가 갈등의 근본 ,Politics
451,    전용열차 동승해 서울로 피해 상인들  사진만 찍고 갔다 ,Politics
452,지속가능한 도시 및 미래지향적 신도시  우뚝   인천형 행정체제 개편  서구 검단구 ,Politics
453,이준석  약속대련  차전은 한동훈 우세승    차전 있을 것 ,Politics
454, 약속대련  주장 이어가는 이준석   차전 한동훈 우세승으로 끝날 것 ,Politics
455,국힘 최승재   대형마트 휴무 폐지  발표에  즉각 철회해야 ,Politics
456,      갈등 봉합  서천 화재현장 상인들  사람 우습게 보이나  분통  영상 ,Politics
457,이재명  이언주에  힘 합치자  복당 권유  진지하게 고민 중 ,Politics
458,이재명   국힘 탈당  이언주에 러브콜 외연확장 나선  ,Politics
459, 인터뷰전문  정청래  대통령 임기  년 남아 윤 한 갈등 결국은 대통령 승리로 끝날 듯 ,Politics
460,새미래 미래연  통합  군불   공동 창당대회 방안 논의중 ,Politics
461, 문재인 패권  이언주  이재명 권유에 복당 검토,Politics
462,   법무부 장관으로 지명한 박성재 전 서울고검장은 누구 ,Politics
463, 단독  중대재해법 기소된 원경환    검증위  적격 ,Politics
464,   도  인사하고 팔 두드리고     정면충돌 이틀 만에  봉합  ,Politics
465,민주당    조 규모  수도권 지상철도 지하화  공약 추진,Politics
466,이재명   윤정부 저격  이언주에 복당 권유 이언주  진지하게 고민  종합 ,Politics
467,  정부 포퓰리즘 남발   포퓰리즘  비판받던 이재명 역공 속내,Politics
468, 윤 대통령  반도체 등 첨단산업 망하게 하려 작정했나 ,Politics
469, 문재인 저격수  이언주  민주당 복당  이재명 권유,Politics
470, 양자 기술 로   극초음속 미사일 잡는다,Politics
471,비명계엔  친명 자객   이언주엔  러브콜   민주당다움 의 다른 잣대,Politics
472, 주목  여의도       험지 출마  전지현 전 행정관  이름값 하는 신세대 여전사 되겠다 ,Politics
473,이재명  대장동 백현동 재판 출석 뒤 건강상 이유로 일찍 퇴정,Politics
474,한동훈 눈발 속  폴더 인사     어깨 툭 치며 악수 청했다,Politics
475, 돌 하나 들겠다  조국도 신당  다음달   심 선고 에 쏠린 눈,Politics
476,안철수  명품 백 의혹  대통령실 입장표명 없으면 총선 악영향 ,Politics
477,  에 있는 엄마가 죽었대요  북한판  안네의 일기  담긴 참상,Politics
478,이준석 개혁신당 대표  인재영입위원장 겸임  예상 뛰어넘는 이들 합류 ,Politics
479,총선 앞 확전 자제    김건희 리스크  등 뇌관은 여전,Politics
480,윤  서천시장 화재에  특별재난지역 선포 가능 여부 검토  종합 ,Politics
481,안형환  서울 송파갑 출마 선언   정부 성공 뒷받침 ,Politics
482,외교부   서 폭행 당한 한국 관광객에 영사조력  외면 논란 반박 종합 ,Politics
483,이재명     탈당  이언주에 복당 권유 이언주  고민 중 ,Politics
484,박지원   이재명 비판  이낙연    김건희엔 못 해  꿀리는 것 있나  딱해  여의도초대석 ,Politics
485, 밀라노서 폭행 당했는데 영사관이 외면    외교부 반박 들어보니,Politics
486, 이 입은 점퍼   과 특검때 함께 입던 패딩이었다,Politics
487,천하람  김 여사 명품백 몰카  재판 증거로 쓸 수 있다 유죄 선고 충분 ,Politics
488, 르포   삶의 터전과 추억이 검은 재로  서천 특화시장 상인들  울분 절망 ,Politics
489,이재명     저격수  이언주에 직접 민주당 복당 권유,Politics
490,개혁신당  주요 당직자 인선 발표 이준석 대표 김숙향 부위원장 등,Politics
491,      사천논란  엿새 만에 서천 화재현장서 만나,Politics
492, 국회의원 입 틀어막기  대통령실 사과 논의도 틀어막혔다,Politics
493,한동훈   도 폴더인사    어깨 툭 충돌 이틀만에 손 잡았다,Politics
494,  법무장관에 박성재 지명  한동훈 조우하며 후임 인선,Politics
495,윤  한동훈 어깨를 두드리고 열차에 동반 탑승 갈등 봉합 수순,Politics
496,악수 나누고  어깨 툭   갈등 봉합 제스처 보인  대통령 한동훈 위원장,Politics
497,일정 바꿔   동행한   직접  갈등 마침표  찍나,Politics
498,김건희  윤석열 한동훈 봉합 승인   김은지의 뉴스   ,Politics
499,조국 수호했던 공지영  욕 먹으며 감쌌는데 배신감 ,Politics
