,titles,category
583,넷플릭스  가입자   억    만명 돌파  마감 후    ,Economy
584,우진엔텍  코스닥 상장 첫날  따따블  핫스탁 ,Economy
585,작년 상장사 자사주 소각     증가 자사주 취득     억 셀트리온 최대,Economy
586,  분기 어닝 쇼크 예상  증권가 목표가 줄하향,Economy
587,메리츠     이노  영억접자 예상    온 실적 부진 영향 ,Economy
588, 세계인 인생 울렸다  농심 신라면  매출  년 연속  조 돌파  사상 최대 ,Economy
589,코스피  희비 엇갈린 뉴욕증시에 하락 출발     선,Economy
590, 현대건설  올해 잠시 숨고르기 기수주 프로젝트에 집중 ,Economy
591,애널리스트의 소신  엔씨소프트  전략 다 바꿔라 ,Economy
592, 이건 사야 해   억 대박 터졌다  슬램덩크  출판사의 변신  이미경의 옹기중기 ,Economy
593,한양증권  파인엠텍  올해 폴더블 힌지에  차전지 부품 매출 확장 등 모멘텀   ,Economy
594,문체부  영종도 인스파이어 외국인 카지노 허가    년 만에 신규,Economy
595,한투운용 금현물      최근  년 원자재     개인순매수  위,Economy
596,   증시 따라잡자  금융당국이 내놓을 계획 알고보니,Economy
597,학생은 누가 가르치나 반도체 전문 교수도 없어 반도체인재  각국도생   ,Economy
598,억울한 오뚜기  중기부 장관 상대 행정소송,Economy
599,지난해 동학개미가 꽂힌 원자재    는          금현물       투자    ,Economy
600,간만에 찜질방 갔는데 이게 무슨 일  연료값 급등에 이용료  헉 ,Economy
601,리모델링파    재건축파 붙은  이 단지       후폭풍에 갈등 폭발,Economy
602, 인터뷰   워킹맘    비대위원 장서정  저출생 대책  혜택 줄게 낳아라 식은 안돼 ,Economy
603,금리 내릴 거라는데  왜 이러지   올 집값 더 떨어진다  한은 주택가격전망  개월째 하락,Economy
604, 공유 이효리 등 빅모델 없었는데  위  소비자 뽑은   월 광고는,Economy
605, 이 남자 가 돌아왔다     억원  줍줍 에 알리바바 급등,Economy
606,  증권  넷마블 투자의견    분기 실적 시장 기대치 밑돌 것 ,Economy
607,투자규모 상위   가 누리는 폐지 혜택  금투세 악법만은 아니다,Economy
608,삼성    취업 보장도 소용 없어 외면당하는  반도체학과  반도체인재  각국도생   ,Economy
609, 영상   지난해      오른 그레이스케일       비트코인 관련주 중 가장 매력적 ,Economy
610,삼성 반도체 메가 클러스터 호재로  용인 에버랜드역 칸타빌  눈길,Economy
611,성능 범용성 둘다 잡았다 삼성전자  소비자용     신제품 출시,Economy
612,경쟁률 상위 독식   세권  아파트의 이유 있는 흥행 가도,Economy
613, 앉아서  억 번다    억 아파트가 반값   로또 줍줍  나왔다,Economy
614,    년 부동산 시장 전망  초고령화 시대  시니어 주택 부각 ,Economy
615,메리츠    이노베이션 목표가   자회사   온 수익성 부진 ,Economy
616,  일 낮기온 영상권 회복 동해안 건조  산불조심  내일날씨 ,Economy
617,롯데 계열사 상품 최대     할인 롯데온   월간 롯데  시작,Economy
618,새마을금고 여신 최대폭 감소 저축은행 대출도   년 만에 줄어,Economy
619,하이투자  현대건설  추가 주가 하락 제한적 우발채무 통제 가능 수준 ,Economy
620,집값 더 떨어지나     부실 우려에 주택가격전망  개월 연속 하락,Economy
621,롯데관광개발   분기보다     년을 보라 유안타,Economy
622,금리인하 기대 속 장점으로 무장한  군산 레이크시티 아이파크  주목,Economy
623,전 세계서  초에   개 팔린 농심  신라면   매출 역대 최대치,Economy
624,포스코     후추위  오늘 회장  차 후보군 압축,Economy
625,넷마블  많은 신작 출시에도 떨어지는 흥행 지속성   ,Economy
626,미래   네오위즈  일시적인 신작 공백기  목표가    하향 ,Economy
627,비나텍  사상 최고 연 매출 기록 예상    ,Economy
628, 대표 나스닥지수      인기몰이    순자산     억 넘었다,Economy
629,         분기 호실적 전망 고객사 다변화 긍정적  한화,Economy
630,새 외국인 카지노   년 만에 문 연다 문체부  인스파이어 운영 허가,Economy
631,삼성증권    현대일렉트릭  분기 어닝 서프라이즈    목표가 상향,Economy
632,영화발전기금 고갈 위기에 넷플릭스 티빙에 부담금 물리나,Economy
633,한화투자증권    아이이테크놀로지  분기 영업익 컨센서스 상회 ,Economy
634,설 앞두고 사과값     폭등 정부  수급 대책 마련 ,Economy
635, 중국 게임 규제 취소 낙관 일러 국내 업체 영향 제한적 ,Economy
636,올해 설 차례상 비용  역대 최고  전통시장 기준   만 원,Economy
637,현대건설  적은 우발채무에    리스크 없어 한투,Economy
638,미래에셋   현대건설  마진율 개선이 관건  목표가     하향 ,Economy
639,신한투자증권  현대건설  수익성 회복 지연 목표가       ,Economy
640,파인엠텍  올해  차전지 부품 외장힌지 매출 발생 기대  한양,Economy
641,올해      번 타자 출격 우진엔텍  따따블 홈런  칠까  이슈 전략 ,Economy
642,  디스플레이   분기만에  흑자  성공   영업이익     억,Economy
643,    하우스 분석  남양유업 볼트온 투자 포문 연  한앤코   결실의 해 맞을까  넘버스 ,Economy
644,  국민은행  작년  금융권 소비자 관심도   위  신한은행  위,Economy
645,원익     아웃퍼폼 여건 마련 수익성 개선 효과도 기대   ,Economy
646,서민 대출창구 거의 셧다운 새마을금고 여신  최대폭  감소 머니뭐니 ,Economy
647,정비사업 표준계약서 건설사  공사비 현실화 긍정 평가     조합  현실성 의문 ,Economy
648, 엔비디아 과매수 심각   차익실현 나서야 ,Economy
649,홍익표 만난 김기문  중대재해법 유예를 극적통과 기대 ,Economy
650, 속보  적자행진 멈췄다      디스플레이     년  분기 흑자전환,Economy
651,부동산    대수술 자기자본 최소     추진,Economy
652,연초부터 뜨거운   랠리 장밋빛 전망 언제까지 ,Economy
653,작년에만     만명이 찾았다   롯데월드타워 몰  역대 최다  방문,Economy
654, 홋카이도 명물  푸딩   편의점     서 두달새   만개 넘게 팔려,Economy
655,부동산 겹악재에 실적  빨간불  금융당국  증권사     만난다  이슈 전략 ,Economy
656, 양현석은    억원어치 주식을 언제 샀을까  공시룰도 모르는   ,Economy
657,메리츠     이노  올해도 수익성 부진 장기화 목표가  ,Economy
658,잠실 롯데월드타워 몰에 작년     만명 찾았다  최다 방문객 기록 ,Economy
659,금리 인하 재평가 구간 속       물가지표 대기모드 채권브리핑 ,Economy
660,        영업익     억원 올리며 흑자전환    실적 개선 총력 ,Economy
661,미래에셋  엔씨소프트  실적 모멘텀 부족 목표가 투자의견  ,Economy
662,문체부  영종도 인스파이어 외국인 카지노 허가   년 만에 신규,Economy
663,신한투자증권  풍산  방산 부문 성장 지속 목표가     ,Economy
664,삼성     현대일렉트릭 목표주가  일 만에 추가 상향    만원 ,Economy
665, 소주 맥주 가격 올렸더니  하이트진로  수익성 개선 전망 한투,Economy
666,     스튜디오드래곤   분기 어닝쇼크 예상 목표가     ,Economy
667,스튜디오드래곤     어닝 쇼크 시간이 필요한 회복   ,Economy
668, 그 아파트엔 뭐가 있길래   년도 안 돼  억원 뛰었다,Economy
669,서랍서 뒹구는  이것   요즘 없어서 못 판다고  전세계 중고폰 인기 왜,Economy
670, 편리미엄 트렌드 타고     청소  설거지  빨래 대신하는   대 가사 해방 가전   오늘의집서 급성장,Economy
671,인도서 난리나더니 결국 삼성  갤럭시     제대로 일냈다,Economy
672,  디스플레이  분기 영업이익  천   억원  분기만에 흑자 전환 종합 ,Economy
673,  홍익표 만난 김기문  중처법 유예 요청 극적 통과 기대 ,Economy
674, 차전지  움직일 포스코그룹 실적   분기만 떼어보면  신인규의 이슈레이더 ,Economy
675, 비전 프로  흥행 돌풍에 견제하는  넷플   올라타는  디즈니  ,Economy
676, 어제장 오늘장  반도체 호재 지속  코스피는 꽁꽁 시장 반전 열쇠는 ,Economy
677, 금리인하 지연에 달러화 반등 환율     원 후반대로 상승 외환브리핑 ,Economy
678,코스맥스  국내외 글로벌 브랜드사 채택 이어지는 중 현대차,Economy
679,고부가      비중 늘었다      흑자 전환 성공 상보 ,Economy
680,    가 되레 악재였을까   억 간다던 비트코인  왜 자꾸 흘러내릴까   투자    ,Economy
681,    빙 엣지     빅테크규제법서 제외키로 가닥 ,Economy
682,  이노베이션   현재 주가 저평가 상태 아냐  목표가  메리츠,Economy
683,한화투자     아이이테크놀로지   분기 컨센서스 상회 전망 ,Economy
684,양현석    억 들여 자사주 샀는데   엔터 주가 결과는 ,Economy
685, 굿모닝 증시 코스피 상승 출발 전망  증시 움직임 예의주시,Economy
686, 호재  맞이할 비트코인  벚꽃 피면 상승세 찾아오나   녹취록 ,Economy
687,강남 구 재건축도  유찰   건설업계 싸늘한 입찰전,Economy
688,텍사스 인스트루먼트  신중한 전망으로 반도체 어닝시즌 개막,Economy
689,노후 공원이 공세권 아파트로  변신  비결은 ,Economy
690,스튜디오드래곤     어닝 쇼크 전망 목표가    만  만   ,Economy
691,풍산  방산 부분 성장세 이어갈 것 목표가  신한,Economy
692, 내 몸 누일 곳이 없다   야 너두   서울 주택보급률 최악이라는데,Economy
693,비트코인   만달러 붕괴 현물     승인 후     급락,Economy
694,   증시부양 위해    조원 쏟는다  월가  아마추어들이 뭘 하나       년 악몽   한상춘의 지금세계는 ,Economy
695, 삼성전자 다 팔고 엔비디아 올인  작년 제일 잘 한일  배 넘게 번 나를 칭찬   투자    ,Economy
696,  억 넘는 아파트를  억 천에  인생 가장 잘한 투자 ,Economy
697,키움증권  엔씨소프트  전략 원점서 재검토 필요 목표가     하향 ,Economy
698, 클릭  종목  풍산  수출 지역 다변화 긍정적 목표가   ,Economy
699, 년 후 물가전망   개월 만에 최저  집값 더 떨어질 것 ,Economy
700, 뉴스새벽배송 실적이 가른 희비        사흘째 최고치,Economy
701,알리바바 급등한 이유 천만주 판다던 마윈     억 상당 매입,Economy
702,뉴욕증시  최고치 경신 이후 혼조세 다우      ,Economy
703, 굿모닝 마켓   과탐욕 직전  뉴욕증시 상승 잔치 진짜 이유는 ,Economy
704,  이노    온 수익성 부진 장기화 목표가      메리츠,Economy
705, 냉탕열탕 부동산  신도시  교통 해방일지  언제쯤 ,Economy
706,  분증시  뉴욕증시  차익실현 압박 속 혼조 다우         ,Economy
707,설 차례상 비용 시장   만원 마트   만원 역대 최고치,Economy
708,일본은 홀렸다  다음은 아중동  뷰티 기술력 입증한 코스맥스,Economy
709, 한국전력 실적  바닥 찍고 반등하고 있어 투자의견  매수     ,Economy
710,현대건설     기대치 하회했지만 올해 영업익 증가 전망 한투,Economy
711,위메이드  올해부터 수익성 개선 본격화 목표주가    만원 미래,Economy
712,  도발  전쟁 염두 아냐 금융시장 불확실성 우려 과도 ,Economy
713,     조원 증시부양에도   홍콩    대폭 손실 불가피,Economy
714,다시 돌아온 반도체    의 시대    훈풍 타고 고공행진  글로벌     트렌드 ,Economy
715,봄바람 불면 내 집 마련 열차 떠난다  영통역자이 프라시엘  계약 순항 예고,Economy
716,  반도체     국가전략기술됐다    투자때  공제 최대   ,Economy
717,지난해 상장사 자사주 소각규모      셀트리온 자사주 취득 최대,Economy
718, 슈퍼갑  된    전문가  연봉  억은 예삿일 ,Economy
719, 통신비 할인액     억원 돌려 달라  카드사들  통신사에 소송,Economy
720, 비싸도 너무 비싸  오픈    왜 반도체 직접 만들려 할까 ,Economy
721,얼굴에 점 찍고 돌아온 중고신인들 삼성 전략제품  신의 한수  될까,Economy
722,보랏빛 컬리   년 만에 첫  월간 흑자  찍었다 상장 재추진 기대감 커져,Economy
723,중국은 팔고 떠나고    일본은 사고 벌고   분 브리프 ,Economy
724,   부실에 몸살  엠캐피탈      억 자산유동화 추진,Economy
725, 김대호 박사의 오늘 기업 사람  엑손 현대차   엔솔    티웨이 에어버스,Economy
726,비트코인      만원대로 주저앉아  일주일만에    급락,Economy
727, 필요할 땐 오라더니 내줄 돈은 없다   춤추는   정책변수에 현대차그룹  혜택 밀리나      플러스 ,Economy
728,  가스  점점 늘어나는 배당 목표주가   만원 하나,Economy
729, 삼성전자 러시아 공장  현지업체 임대 가능성 ,Economy
730, 마케팅비책  사춘기 소녀 감성 사로잡은 옷  엄마도 만족해요 ,Economy
731, 뉴욕증시           최고가 갈아치웠다  엔비디아     달러 눈앞,Economy
732, 엘앤에프 코스피로 이전 에코프로 형제  최대 수혜  ,Economy
733, 손안의 등골 브레이커   차라리 저렴한 중고폰 쓸래,Economy
734,    공동주택용지 분양대금 연체액    조 돌파,Economy
735,  억 성수 트리마제    억에 줍줍 김지훈  인생 최고 투자 ,Economy
736,국내 상장사  지난해 자사주    조원 소각 신한지주 현대차 최대,Economy
737, 주주 위해 불 태웠다  작년 상장사 자사주 소각     증가  투자    ,Economy
738, 부진한   증시에   랠리 편승 어려운 상황 ,Economy
739,가격 부담에 뉴욕 증시 혼조세,Economy
740, 반도체 가격상승세 지속 삼성전자   하이닉스 영업이익   조  ,Economy
741,롯데케미칼  목표주가     만   만    ,Economy
742,새마을금고 여신 최대폭 감소  외환위기 이후 처음,Economy
743, 관 출신 안돼     금융  은행장 출신 회장 후보 경합할까,Economy
744, 손 대면 안 될 정도  가짜 명품 검사해 보니  발암 물질  나와,Economy
745, 굿모닝경제  중처법 확대 시행       중기는 하소연 논의는 공전,Economy
746,마트 시장 가면 한숨만  푹푹  설 차례상 비용 따져보니,Economy
747, 글로벌 리치   채권왕  빌 그로스  증시 최고치 경신 말 안 돼 ,Economy
748, 뉴스 돋보기  손 맞잡은 윤석열 한동훈 갈등 봉합 수순,Economy
749,삼성     가 해외에 첨단 반도체 생산기지  결국 믿을 건  안방  뿐  김민지의 칩만사  ,Economy
750,뉴욕증시  기업실적 부진에 혼조 마감            출근전 꼭 글로벌브리핑 ,Economy
751,넷플릭스 가입자    억명 돌파   시간외    급등,Economy
752,  플랫폼 추격에 마트 새벽배송까지 이커머스  샌드위치 신세,Economy
753, 시대가 어느 시댄데  적금 트렌드 달라졌다  한달 적금  흥행몰이,Economy
754, 거래중단 처분  오뚜기 면사랑  중기부 장관 행정소송 걸어,Economy
755,주담대 갈아탈때도 이자 소득공제 세법시행령 이렇게 바뀐다,Economy
756,올해만      억 손실 홍콩     피해  눈덩이 ,Economy
757,장마가 길어지면 재건축 분담금은 폭등합니다  더 머니이스트 최원철의 미래집 ,Economy
758, 이 자리에 월세     만원 말이 됩니까  대기업도 짐 쌌다  현장  ,Economy
759,   증시 어둡다  중학개미들 한 달 만에     억 원 뺐다,Economy
760,주택 용지  벌떼 분양  받더니 토지대금 연체  비상등  켜진 건설사들,Economy
761,월가   트럼프  기  시나리오 주판알  재정적자 채권 발작 우려 ,Economy
762,씨티  올해 말         까지 상승    상저하고 전망  뉴욕마감 ,Economy
763, 트렌딩 핫스톡  넷플릭스 내년부터     생중계 계약 규모   억달러,Economy
764, 글로벌 마켓  뉴욕증시  실적장세 본격화 최고가 경신 부담에 혼조,Economy
765, 역대 최다  작년 롯데월드타워 몰     만명이 찾았다,Economy
766,지수별 혼조 다우 내리고         연속 사상 최고 경신 뉴욕마감 ,Economy
767, 아파트 지어줄 시공사 어디 없나요  유찰 이어지는 정비사업장  집슐랭 ,Economy
768, 인터뷰    디자이너 브랜드 성공방정식은  물건수 줄이고 꾸준히 팔아라 ,Economy
769, 거버넌스워치 서울가스   증권발 폭락 직전 내다 판  촌조카들  누구 ,Economy
770, 시장  트럼프  기 재정위기 간과하고 있다 ,Economy
771,한화 김동관  사장 때 부회장보다     더 받았다,Economy
772,미 일 증시 훨훨 나는데 코리아 디스카운트 여전  한강로 경제브리핑 ,Economy
773,한화  성과 없어도  개월 재직 땐     보상 사실상 주식 고정급,Economy
774,     년  기 부가세 확정신고   확인 안했다간 낭패 달라진 세법은,Economy
775, 어디까지 오르나       다우지수         연일 최고치 경신,Economy
776,탁보그룹  중국 휴머노이드 로봇 산업 육성 수혜주  돈 되는 해외 주식 ,Economy
777,오뚜기  매형 기업과 거래중단 위기  중기부 상대 소송,Economy
778,방문규 김완섭 노형욱 안도걸 총선 앞으로 기재 산업부     금배지  노린다,Economy
779, 박진영이 쏘아올린 공  양현석        억  통큰 매수  효과 있을까,Economy
780,은행 대출 규제 피해 보험사로 약관 신용대출   조 눈앞,Economy
781,  년 적자 못 버티고  국내 코인거래소 코빗  두번째 희망퇴직,Economy
782,이자 쏠쏠하네 새해 은행권 알짜 특판 상품 살펴보니,Economy
783,해운동맹 재편에 비상 걸린 부산항  환적 물량 쟁탈전 본격화,Economy
784,제약 바이오  훈풍에 투심 쏠린  삼바     실적 발표 주목  이코노  인공 ,Economy
785,홍콩     첫 상장폐지 개미 저가매수 증가  우려 ,Economy
786, 금리 맛집  소문난 인뱅  주담대 확장세에 시중은행도  긴장 ,Economy
787,실적 환율 금리   중고    지정학적 리스크까지  증시 역주행  ,Economy
788,   억년에  초 오차    원자시계   한국형 위성항법시스템 뜬다,Economy
789,전세가는 어쩌다   만원 단위까지 거래되고 있을까 ,Economy
790,뉴욕증시         사흘 내리 사상최고   다우는 하락,Economy
791, 차전지      대 하락  예삿일  올해 주가 반등 쉽지 않다 ,Economy
792,뉴욕증시  차익실현 압박 속 혼조 다우      마감,Economy
793,반도체 스마트폰  위 내준 삼성 사법 리스크 넘을까,Economy
794,정몽규 회장의 재계 상승 꿈      실패 이어 사고로 휘청,Economy
795,    이어 양현석도 자사주 매입 엔터주 바닥 신호일까,Economy
796,피벗 파티 끝나고 실적에 따라 엇갈린 뉴욕증시 월스트리트   ,Economy
797, 르포    년 된 롯데리아마저 폐점   젊음의 거리 였던 신촌  텅 빈 거리로,Economy
798, 뉴욕증시 기업실적 소화하며 혼조 마감 다우만 하락세,Economy
799,홍콩      코인     어떻게 오늘 김주현 이복현 간담회,Economy
800,  증시도 이끄는  반도체         빅테크  실적 시즌 시작에 촉각,Economy
801, 홍콩  지수  악몽 현실로  미래에셋 삼성  항셍테크         곤두박질,Economy
802,     순위 다툼 치열  올해  위 경쟁 뜨거워진다,Economy
803,전기차 시장 가파른 둔화세에 배터리업계  한파   내실 다지기 ,Economy
804, 기로의상장사 스피어파워  옵티머스 횡령  스킨앤스킨 전 경영진 합류,Economy
805,아파트 사고 후 지속된 인사 쇄신     현대산업개발 혼란,Economy
806, 수익성 개선   커머스 업계       기지개 ,Economy
807,믿을 곳은  반도체  반도체에 돈 몰린다,Economy
808,비트코인 하락의 끝은    월만 기다린다   글로벌 뉴스픽 ,Economy
809,건설 경기 시들한데 한수원     억 고리원전 입찰제한 논란,Economy
810,이부진 입은 투피스  하루만에 판매량     배  뛰었다,Economy
811,유가 소폭 하락 리비아 생산 재개  미국 북극한파 후퇴 종합 ,Economy
812, 공사비 대결  삼성  포스코 승자는 ,Economy
813,  억대 아파트  분양권    억에 샀다 는 김지훈 비결 들어보니  이슈  풀어주리 ,Economy
814, 트럼프 시즌     반도체엔 시련 미 중 사이 새우등 신세 ,Economy
815,시장금리 하락에  파킹통장 도 매력 뚝,Economy
816, 중국에 당했대  주가 와르르 기술유출  쉬쉬  하는 이유,Economy
817, 교통시대  호선연장 중재안 내놨지만  영  서지 않는 대광위,Economy
818, 청년빈곤시대   상위      금수저  청년 평균 자산   억 육박     는  난 빈곤층 ,Economy
819,유럽 부동산 펀드 괴롭히는 또 다른 요인  환헤지     디폴트 트리거될 수도,Economy
820, 인터뷰  천재 개발자들이 만든  전자차트계의 테슬라     의사와 환자 더 가까워질 것 ,Economy
821, 에드몬슨식  딱지에서  코레일톡  앱까지 한국철도 승차권    년 ,Economy
822, 삼성전자로    반도체 주문 늘어난다  빠른 시제품이 경쟁력,Economy
823,  건설 동남아로 간다    대중교통  빈약한 마닐라에  남북철도  뚫는 현대건설    건설 떠난 자리 메웠다 ,Economy
824,올해 들어 매일 내리다 딱 하루  찔끔 반등 한   이노베이션    앞으로도 만만찮다,Economy
825, 잭팟 인 줄 알았는데    억 날린대도  손절 이 최선이었다 위기의 건설업 ,Economy
826,     교체기 에만 목소리 내는 국민연금  박상영의 기업본색 ,Economy
827,작년 상장사 자사주 소각규모      자사주 취득 셀트리온 최대,Economy
828,세입자에게 더 추운 겨울 집도 세탁기처럼 에너지등급 보고 고른다면 올앳부동산 ,Economy
829,얼어붙은  금융권 대출 새마을금고 여신 최대폭 감소,Economy
830, 갈아탈 대출이 없네  저축은행 중도상환수수료  반토막 ,Economy
831,탑승객 적어도 돈 잘 버네      틈새 파고든 에어프레미아,Economy
832,부도  공사중단  미분양에 공매까지 벼랑 끝 건설업계,Economy
833,   반도체 경쟁력     하이닉스  분기  흑전  기대감,Economy
834,메디톡스     에  휴젤 영업비밀도용  혐의 제외 신청 왜 ,Economy
835, 조원대 소송예고 공개매수 촉구 연초부터 불붙은  행동주의 펀드 ,Economy
836, 삼바  키운 정책이  삼바  옥죈다 부지 못 잡는  송도 터줏대감 ,Economy
837,월세가 아반떼 한 대값 그들만의  초고가 월세  리그,Economy
838, 여보  옆집 윗집 다 바꿨다는데 우리는      조원 몰린  환승대출 ,Economy
839, 재건축 하고 싶지만  내홍 겪는 리모델링 조합,Economy
840,금융위  스트레스     도입 속도 낸다  주담대 한도      뚝 ,Economy
841,전자업계  오늘   일 부터 실적 발표  혹한기 지속 전망,Economy
842, 수소경제 의 신호탄  암모니아 운반선  조선  사 앞다퉈 수주,Economy
843,평당  억    만원  포제스 한강  이번 주 분양 흥행할까,Economy
844,초단기     찾는 기업들  랩 신탁 대신 뭉칫돈 몰린다,Economy
845,공사비 올린적 없는데  공사비 높다  난처한 건설업계,Economy
846, 실수요 자금 대비   교보생명  신용대출한도 최대     만원으로,Economy
847,희비 엇갈린 은행 보험 온라인 플랫폼  수수료가 관건 ,Economy
848,승부수 띄운 넷플릭스 프로레슬링 중계권에  조원 투입,Economy
849,집값 내리는데 분양가는 왜 이래 서울도  청약 미달  행진,Economy
850,부실시공으로 무너지면  적극 보상   안 무너지면  외면 ,Economy
851,슬금슬금 다시 오르는 주담대 고정금리,Economy
852, 호화 출장  포스코 후추위  갖은 논란에도  마이웨이 ,Economy
853,   자영업자 종노릇  비판에도 우리은행  개인사업자   대 이자장사  최고 ,Economy
854, 증시부양 패키지  쏟아낸   항셍지수 급반등,Economy
855, 치솟았던 집값 다 토해내  일산 집주인들  악  소리 부릿지 ,Economy
856, 조원 대 소송까지  사장 선출 앞두고 혼돈의     ,Economy
857, 지배구조 바꿔라        시끌 ,Economy
858,훨훨 나는   맥 못추는       증시  희비 ,Economy
859,지방  준공 후 미분양  종부세 중과 배제 기준 보니,Economy
860,    원  갓성비  세종청사 식당에 찬바람 왜  관가 블로그 ,Economy
861,비서로  집사로 진화한     인간처럼 추론하는        도 온다     블랙홀 시대 인간다움을 묻다 ,Economy
862,   가 곧 인간의 지능 넘을 것          시대까지 갈 길 멀어      블랙홀 시대 인간다움을 묻다 ,Economy
863,세 자녀 이상 가구   개소세 감면 확대,Economy
864,    대책에도 짙어진 관망세 매매도 전세도  꽁꽁 ,Economy
865, 호화 이사회  포스코후추위의 직진 오늘  차 회장 후보군 압축,Economy
