,titles,category
290,컬리까지     재추진 가능성  올해  조 단위  상장사 쏟아지나,Economy
291,이마트  오렌지 한라봉 딸기 최대     싸게 판매,Economy
292, 아파트 사면 와이프 공짜로 드림   폭망  위기  회사 엽기광고,Economy
293,청년도약계좌 중도 해지해도      이자 받는다,Economy
294,새해 치고 올라가는   반도체        수익률     넘어,Economy
295, 주가동향  포스코인터내셔널  첫 영업익  조 돌파 소식에    강세,Economy
296,포스코홀딩스   년 만에 역성장 매출   조 꿈  내년에나 ,Economy
297,여야 원내대표 찾은 김기문  중대재해법 유예 극적 통과되길 ,Economy
298, 주일간     오른 게임 대장주 크래프톤 상승세 이어질까,Economy
299,비트코인  만    달러 붕괴 투자자      몇년 내 사라질것 ,Economy
300, 분양가상한제  단지만 인기  제일풍경채 검단 차      대  ,Economy
301,설 차례상 비용 전통시장   만원 대형마트   만원  역대 최고 ,Economy
302, 재택근무자부터 자른다        명 감원한다는 간 큰 회사의 공고,Economy
303, 후쿠시마 오염수 때문에       중국서         매출     급감,Economy
304, 금융권 대출도  한파  새마을금고 여신 최대 폭 감소,Economy
305,보령 당뇨약  트루다파  제품군  후발약 시장 처방실적  위 기록,Economy
306,이복현  부동산    리스크 관리 실패한 증권사에 책임 묻겠다 ,Economy
307, 갈아탈 만하네  주담대 환승에 이자     만원  뚝 ,Economy
308, 신난 일학개미들    반도체     역대급 랠리,Economy
309, 이코노미스트         월에 미 금리 인하 시작 ,Economy
310,올해 첫 공모주 우진엔텍  코스닥 입성 첫날  따따블 ,Economy
311, 운전하다 속 터졌는데  진작 좀 해주지  벤츠 차주들  술렁 ,Economy
312, 오뚜기  세  함연지 공식 등판    식품전시회서 목격,Economy
313,연료비 급등에 찜질방 목욕탕 이용료      ,Economy
314,엔데믹에 날개 달은      올해는 장거리 노선으로 ,Economy
315,샌드위치 먹으면 갤    준다고   행운의 망곰이 잡아라 ,Economy
316,사과  개에  만    원 설 차례상 비용 역대 최고,Economy
317,아시아 경기 부진에 뛰는 환율 중국에 발목 잡힌 경제,Economy
318,  디스플레이 유상증자  차 발행가액  만  원,Economy
319, 한국형 뉴 스페이스  가동 한화시스템 소형     위성 우주로,Economy
320,금감원장     리스크 관리 실패  경영진 엄중 책임 물을 것 ,Economy
321,   만원대 고가 홍삼   부촌  평창동 한남동에서 인기,Economy
322,미국 호주 베트남에도     농심 신라면 매출  사상 최대 ,Economy
323, 단독  코스알엑스 인수 효과  아모레  모건스탠리    소비주 탑픽 ,Economy
324,김주현  기업가치 개선 주문  기업밸류업 프로그램 도입 ,Economy
325,급락 멈춘 비트코인 매물폭탄은 아직 남아있다  매일코인 ,Economy
326,암표에 취소됐던 장범준 공연  꼼수 원천차단  티켓으로 다시 연다,Economy
327,원자재 투자     그 중에서도 현물로 모이는 까닭은,Economy
328, 영하   도 한파에도 대기줄   아침빵  점심도 저녁도  베이글 ,Economy
329,올 것이 왔다  워크아웃 태영    개 하도급에 대금 미지급 등 피해,Economy
330,토스뱅크 외화통장   만좌 돌파   초에  명씩 가입 ,Economy
331,위험 눈감은 새마을금고 경영진들 남들 멈출 때   대출 역주행  패착 ,Economy
332,코리아 프리미엄 지수 만든다 기업가치 높은 밸류업기업에 집중 투자,Economy
333,시중은행 경영 효율성 살펴보니 하나      우리  저조 ,Economy
334,부산 북항재개발지 내 이순신대로   일 개통,Economy
335,비트코인      이상  폭락  현물     승인에도 연일 하락세  왜 ,Economy
336,한미약품 전략  기술수출 자체 상용화로 바뀔까,Economy
337, 침수 위험 도로입니다   내비에 이런 기능까지 ,Economy
338,맥 목추는  차전지주  에코프로  형제  장초반 급락 핫종목 ,Economy
339,그레이스케일 매도세에 하락세 탄 비트코인   만달러선 반납 코인브리핑 ,Economy
340, 급락 급등 급락  롤러코스터 탄  한동훈 테마주  핫종목 ,Economy
341,차례상 비용 역대 최고치 전통시장   만원 대형마트   만원,Economy
342,농심 신라면    푸드 열풍 에  년 연속 매출  조 달성   사상 최대 실적 ,Economy
343,셀트리온    우시   와 항체 약물접합체 신약 개발 협약,Economy
344,하나증권  제이스텍  인도향  조원대 대규모 수주기대  저평가 매력  ,Economy
345,증권사     만난 금융당국 수장들     리스크 관리 실패시 엄중 책임 ,Economy
346,  초에  명 씩 가입 토스뱅크 외화통장    만좌 돌파,Economy
347,과기정통부   전국민    일상화  선언     매주  곳 이상 방문 ,Economy
348,철강시황 부진 탓에 포스코홀딩스 작년 영업익  조 천억원 전년 대비    감소,Economy
349, 단독  다단계 의심 업체에 결제 시스템  구멍  뚫린 토스페이먼츠,Economy
350,노동 중기 국토장관  중대재해법 유예안 통과 촉구  오늘이 마지막 기회 ,Economy
351, 주가동향  이베스트증권     억 규모 자사주 매입에    상승,Economy
352,고가 법인차   연두색 번호판  달아야 손금 처리 해준다,Economy
353, 주가동향  현대건설  증권가 목표가 줄하향 속   대 약세,Economy
354,이복현 증권사    에     리스크 관리 실패 시 책임하게 엄중히 묻겠다 ,Economy
355,미국 대선 경합주 절반 실업률    이상  년 만에 최고,Economy
356,  인 미만 중대재해법     김기문 중기회장  여야 만나 유예 호소,Economy
357, 쫌아는기자들  시마크로  제조업의 영화 같은 변화를 만들어 낼  디지털 트윈 솔루션,Economy
358,채용 봇물 터지던  이 업계    최근 인력감축에 한숨 푹,Economy
359,중처법    인 미만  확대 시행     정부의  마지막 호소 ,Economy
360, 쫌아는기자들  시마크로  제조업의 영화 같은 변화를 만들어 낼  디지털 트윈 솔루션,Economy
361,채용 봇물 터지던  이 업계    최근 인력감축에 한숨 푹,Economy
362,중처법    인 미만  확대 시행     정부의  마지막 호소 ,Economy
363,고용장관  중처법 확대     만 일자리 피해  산안청 신설은 거부,Economy
364,토스뱅크  무료환전  외화통장  일 만에   만좌 돌파,Economy
365,셀트리온  중국 우시   와     신약 개발 협력,Economy
366, 단독  류진  한경협에      에코프로  첫 합류 외연 확장 시동,Economy
367,  초에   개씩 팔린다  신라면   년 연속 매출  조원 돌파,Economy
368, 깜짝 실적  거둔 넷플릭스  라이브 스트리밍으로 발 넓힌다 종합 ,Economy
369, 우리 국민 한번씩은 다녀갔다 는 롯데월드타워 몰 작년     만명이 찾았다,Economy
370, 종목이슈  일동제약  상향된    실적 예상치와 경구용       가치 주목,Economy
371, 실패하면 책임 묻겠다  증권사 사장들 다그친 이복현  금융당국 포커스 ,Economy
372,삼성전자  소비자용               출시 낸드 부활 앞당긴다,Economy
373,도요타 시가총액  기업 중 사상 최대,Economy
374,카카오    수사 넓히는 당국 원아시아  명 검찰 송치,Economy
375,넷플릭스   분기 구독자 수  억    만명 전분기      만명 ,Economy
376, 옷 좀 새로 사   이게 트렌드야  낡고 구멍 난 옷 사는 사람들,Economy
377,     직장인  출퇴근 스트레스 해법은  자율출퇴근제 ,Economy
378, 보험 상담은 역시 사람이    보험비교 추천서비스  등장했지만 설계사들 느긋한 이유,Economy
379,값싼 나트륨이온배터리      제치나      년엔 시장 규모   조 ,Economy
380,마윈 차이충신  알리바바 주식 매입 나서 주가 구원투수로,Economy
381,중처법 전면 시행     정부  영세 사업장 준비 기회 달라 ,Economy
382,박상우 장관  임기내 재건축 패러다임 새로 짜겠다 ,Economy
383, 그 때 팔았어야        승인 후 비트코인     이상 급락,Economy
384,미신고 계좌로 주식투자한 금감원 거래소 직원   무더기 과태료 처분,Economy
385,김해공항 신규 면세점 입찰  흥행 저조   설명회에 단  곳 참여  언박싱 ,Economy
386,김주현 이복현  증권사 책임 역할 강조  강도 높은 자정 노력 필요 ,Economy
387, 중대재해법 확대 시행시 동네 빵집도 적용대상 ,Economy
388,키움운용   반도체     올 수익률  위,Economy
389,이차전지  날개 없는 추락  올 들어 시총     증발  투자    ,Economy
390, 금딸기 대신 이거  비싼 과일 값에  인기 폭발  반전 제품,Economy
391, 푸바오 이젠 안녕   살 푸바오  월 초 중국 귀환,Economy
392,  증시 부양책 나와도  투자자  회의적  근본적 해법 요구 ,Economy
393,한국서  시간 머무는 올트먼 최태원 경계현과 숨가쁜 일정,Economy
394,청약증거금  조 천억 끌어모았던 이 종목 상장 첫날 따따블 직행,Economy
395,나트륨이온배터리      배터리 제치고  중저가 대세  될까    리서치      년 시장 규모   조원 육박 ,Economy
396,세계가 매운 맛 봤다 작년에만  천억원  깜짝 ,Economy
397,비트코인      만원 회복 레이어 코인  형제는     급등,Economy
398,검단 교통 호재 수혜  검단신도시 넥스티엘 복합문화상업시설  공급,Economy
399,단통법 폐지 추진하지만 갤    등 휴대폰 가격 인하까지는  첩첩산중 ,Economy
400,  시간 자면    만원 드려요  경쟁률  만대   꿀알바 ,Economy
401,증권사     만난 이복현     리스크 관리 실패시 엄중한 책임 ,Economy
402,   억  성수 트리마제  억 천에 산 김지훈    인생 최고의 투자 ,Economy
403,시몬스  시급    만원  당근알바 시몬스 겨울잠 알바 에  만명 몰렸다,Economy
404, 나트륨이온 배터리      년    보다 최대     저렴해질 것 ,Economy
405,거래소  코리아 프리미엄 지수  만든다  투자    ,Economy
406,이복현  증권사 직원 사익추구  단호히 대응해야  전문 ,Economy
407,          그룹 합류한 이베스트투자증권  자사주 취득에 강세,Economy
408,광주 전남 건설업계 위기 확산  곳 또 법정관리,Economy
409,여야 원내대표 만난 김기문  중대재해법 유예해야  호소,Economy
410,이복현  리스크 관리 실패  증권사 경영진에 책임 묻겠다 ,Economy
411,김주현  금투세 폐지  지배구조 개선해 국민 자산형성 지원 ,Economy
412,김주현 이복현 간담회     부실 증권사     책임 묻겠다 ,Economy
413,금융당국 수장들  증권사  단기 수익에 매몰되지 말아야 ,Economy
414,  년 전 쓰레기 종량제 도입이 다시 봐도 신기한 이유 딥다이브 ,Economy
415,상사 최초   조 클럽  등극 포스코인터내셔널    대 ,Economy
416, 증권채만 비켜간 연초효과     중소형 증권사는 건설사 취급,Economy
417,푸드 브랜드  이그니스   코스닥 상장 추진  시그널 ,Economy
418,이복현  증권사    에  리스크관리  직접 챙겨달라  주문,Economy
419,이복현의 경고   부동산   리스크 증권사    가 직접 챙겨라 ,Economy
420,푸드 브랜드  이그니스   코스닥 상장 추진  시그널 ,Economy
421,이복현  증권사    에  리스크관리  직접 챙겨달라  주문,Economy
422,이복현의 경고   부동산   리스크 증권사    가 직접 챙겨라 ,Economy
423,김주현  증시 저평가 해소 위해선 기업 스스로 해결할 과제 상당수 ,Economy
424, 르포   공실률      핫 한 기업 몰리는 성수동  불황  잊었다,Economy
425,콘서트 암표 기승에  현대카드  장범준과    티켓 내놓는다,Economy
426,서울 한 뼘  마포구 덕은동  덕은지구 오피스 시장  재조명 ,Economy
427,계속되는 분양가 상승  금융혜택 제공으로 부담 없는 새 아파트 눈길,Economy
428,소프트웨어업체      직원  천명  퇴직 재교육  구조조정,Economy
429,직접 검증하는 준공 후 분양단지  에스아이팰리스 올림픽공원  관심,Economy
430,      개 분기 만에  적자 탈출        중심으로 수익성 강화 ,Economy
431,미 훈풍 무색한 국내 반도체주 삼성전자 장초반    급락 핫종목 ,Economy
432, 한국서 코인 좀 대신 사줘  미국인이 부탁했다  한경 코알라 ,Economy
433,    당  억 훌쩍  포제스 한강    일  순위 청약,Economy
434,  디스플레이   분기만의 흑자 전환에도 주가 혼조세,Economy
435, 호주는 아침  시부터  대형마트 영업시간 조정  가능할까  언박싱 ,Economy
436,열에 아홉은 뉴욕장 해외 주식    편식 비중  역대 최대  왜   투자    ,Economy
437,시몬스 침대  시급    만 원  겨울잠 알바 에  만명 몰렸다,Economy
438,농심신라면  작년매출  조 천억원  사상최대  해외가 절반 넘어,Economy
439, 공모주 단골 청약 매매 보고 누락  금감원 거래소 직원 무더기 제재,Economy
440,대한항공 아시아나 합병 윤곽  산은  일석이조  기대감  투자    ,Economy
441,경기  국평  분양가  년새  억 뛰었다 광주는     상승 집슐랭 ,Economy
442, 올레드에만     투입    디스플레이  유상증자로 경쟁력 강화,Economy
443,  온 적자 지속에   이노 기업가치 뚝,Economy
444,골드만삭스   증시 최악 땐 외국인투자금     억  유출 ,Economy
445,중화권 시가총액   년간   천조원 증발  영국      배,Economy
446,코스피  외인 기관  팔자  속 하락세      대 종합 ,Economy
447,     피엠티와 낸드     프로브 카드 마스크리스 공정 장비 계약,Economy
448, 뺏느냐 뺏기느냐  김포공항 출국장 면세점서 롯데 신라  격돌 ,Economy
449,대세는   반도체    글로벌  반도체      연초 이후 수익률  위  투자    ,Economy
450,피부에 직접 닿는데   샤넬 디올 구찌  짝퉁 귀걸이 에 발암물질이 ,Economy
451,   만화 웹툰  진흥 계획 발표에 웹툰 관련  급등 핫종목 ,Economy
452,한파에 생각나는 찜질방 목욕탕 요금     뛰었다   왜 그런가 보니,Economy
453,엔씨소프트 목표가 후려친 키움 리폿  전략 다 바꿔라 ,Economy
454, 나트륨이온배터리     와 경쟁     년 시장 규모   조 ,Economy
455,   년만 최대 영업익  대한전선     대  상승 ,Economy
456,지난해 롯데월드타워 몰     만 명이 찾았다  역대 최다 ,Economy
457, 기계공학 기술력 통했다  현대위아  등속조인트 글로벌 수주  껑충 ,Economy
458,작년  주택임대기업 주택 구매     급감  올해도 침체 ,Economy
459, 겨울잠 자면 시급 지급  시몬스  겨울잠 알바 경쟁률  만대  ,Economy
460, 기계공학 기술력 통했다  현대위아  등속조인트 글로벌 수주  껑충 ,Economy
461,작년  주택임대기업 주택 구매     급감  올해도 침체 ,Economy
462, 겨울잠 자면 시급 지급  시몬스  겨울잠 알바 경쟁률  만대  ,Economy
463, 병원 함부로 가면 안 되겠네  보험료  껑충  대비책은  하우머니 ,Economy
464,벼랑끝 건설사 올들어서도   곳 법정관리  분양보증 사고도 급증,Economy
465,사흘 앞 다가온   인 미만 사업장 중처법 적용 정부  시행 유예  촉구 ,Economy
466, 친절한 경제  미중 무역갈등 여파    조 원짜리 공장 에도 ,Economy
467,  년 만에 외국인 전용 카지노 국내에 문 연다,Economy
468,    반도체가 대세  키움  글로벌  반도체      올 수익률  위,Economy
469,전 구간 착공 앞둔  동탄인덕원선  수혜 분양 단지 어디 ,Economy
470,전세계서  초에   개씩 팔린 한국 제품 사상 최대 매출 쓴  신라면 ,Economy
471,개인이  년간 가장 많이 순매수한 원자재    는  한투운용     금현물     ,Economy
472,메디톡스   뉴라덤 코어타임 앰플  홈쇼핑  사 완판,Economy
473,토스뱅크 외화통장  출시  일 만에   만좌 돌파   대가 가장 많아,Economy
474,꽁꽁 언 하늘 길  항공    편 결항 수도계량기 동파도 잇달아,Economy
475,비트코인 비관론 확산   투자자 셋 중 하나   만달러 아래 추락 ,Economy
476,전기차 수요 둔화에 포스코퓨처엠 작년 영업익       ,Economy
477, 이 정도면 거래절벽  내 집 마련도 이사도 올스톱  매매 전세거래  뚝 ,Economy
478,경기  분양가  년새  억원 올랐다,Economy
479,내일 실적발표   하이닉스  년만에 흑자전환땐  증시도 살아날까,Economy
480,수억 달러 쏟아부었지만 애플카  출시 지연에 성능도 하향,Economy
481,눈구름 약해져 적설량 하향 내륙 최대    제주 울릉도    ,Economy
482,현대위아  작년 등속조인트  조원 수주 비결은 고효율 저진동,Economy
483,뷔 유광굉 만나는 컴포즈커피 유튜브 광고 조회수 하루 만에    만 돌파,Economy
484,교보 신한                보험사  신용대출금리 고공행진,Economy
485,올해 첫 상장 우진엔텍  따따블  성공,Economy
486,지난해 롯데월드타워 몰     만명 찾았다 인기 비결은,Economy
487,현대카드  가수 장범준과      티켓 으로 암표없는 공연 개최,Economy
488, 넷플릭스 가입자    억명 돌파      콘텐츠  랠리,Economy
489,     채권도 잘 팔리는데          안간힘 끝에 완판,Economy
490, 이제    도    로 굴린다               액티브      일반공모형 유입세 앞질러  투자    ,Economy
491,세종시 시내버스 공영자전거 이용객 급증 코로나 이전 수준 회복,Economy
492,기재부 차관   월 말     공시기준 초안 공개 산업계 의견 충분히 수렴 ,Economy
493,문체부  인천 인스파이어  외국인 카지노  허가,Economy
494,이베스트      억 자사주 취득  주가는 급등,Economy
495,경기도  국민평형  분양가  년새  억원 가까이 올라,Economy
496, 온디바이스   시장 성장 수혜  코세스  증권가 낙관에 주가 급등,Economy
497, 이 시각 딜링룸  주요국 통화정책  동결  전망 환율 변동성 주의보,Economy
498,  분기만에 흑자 전환  주가는 무덤덤,Economy
499, 단독  트롯돌 이찬원   구전녹용   대 모델 됐다,Economy
500,코스피  외인 기관  팔자 에 하락 출발     선 하회,Economy
501,출생아     명  서울    아기 낳으면 성인까지  억원 지원 ,Economy
502,  억 트리마제    년전  억    만원에 샀다 김지훈의  인생 재테크 ,Economy
503,수백억대 자사주 매입  잇따르는 호재에 이베스트증권     ,Economy
504,미래에셋증권  외화채  억달러 발행 성공   올해 증권사 외화채 물꼬,Economy
505,사과  개에  만  천 원 설 차례상 비용  역대 최고 ,Economy
506,     토요 사장단 회의  부활  거문고 줄 고쳐 맨다 ,Economy
507, 주가동향  올해  첫      우진엔텍  상장 첫날 장 초반  따따블  달성,Economy
508,    개발 속도 내는 셀트리온   우시와 협업 강화,Economy
509, 고사직전  온투업권 기관투자 허용  개인투자한도도  천만원까지 확대,Economy
510,삼성전자  소비자용     신제품 출시,Economy
511,시총상위주  일제히 하락 삼성전자   하이닉스   대 ,Economy
512,토니모리  영업이익 흑자 전환 예상   해외 매출  유안타증권,Economy
513,셀트리온  우시와 협업해     신약 개발 가속화,Economy
514, 현대건설  해외공사 마진 점차 상승  한투,Economy
515,코츠테크놀로지  원익피앤이와 발전소용 콘트롤러 개발 박차  민수사업 확대 ,Economy
516, 직원이 총기부품 수백억원 불법수출 혐의     모티브  엄중 처벌 필요 ,Economy
517, 넷마블   분기 실적 기대 밑돌듯 투자의견  중립  하향 ,Economy
518,설 대목 앞두고 한우고기값 급락 한우협회   정부 나서달라 ,Economy
519, 이러다 중소기업 다 죽습니다  김기문 하소연에 홍익표가 한 말,Economy
520, 넷마블   분기 실적 기대 밑돌듯 투자의견  중립  하향 ,Economy
521,설 대목 앞두고 한우고기값 급락 한우협회   정부 나서달라 ,Economy
522, 이러다 중소기업 다 죽습니다  김기문 하소연에 홍익표가 한 말,Economy
523, 겨울왕국  날씨에 결항 동파 속출,Economy
524,송도지구 초대형 단지  송도자이풍경채 그라노블  이달 분양,Economy
525,보령  당뇨치료제  트루다파  제네릭 처방  위 점유율    ,Economy
526,금리인하 기대에 주목받는 금      금현물      개인순매수  위,Economy
527,넷플릭스  작년  분기 신규 가입자 급증     프로레슬링 독점 중계권 확보,Economy
528,  월 금리동결 전망에  강달러  환율  장중     원 부근까지 상승,Economy
529, 다 올랐네   역대 최고 라는 올해 설  인가족 차례상 비용,Economy
530, 쿠팡 네이버 멤버십 공짜  케이뱅크 생활통장  인기 폭발 ,Economy
531,다날   배터리카드 자동충전하고 용돈 받아가세요 ,Economy
532,건정연  부동산    위기로 전문건설업체 피해 확산 우려 ,Economy
533,현대카드  가수 장범준과      티켓 으로 암표 없는 공연 만든다,Economy
534,다날   다날 배터리 카드  자동충전 오픈,Economy
535,     올해가 우주항공 투자 원년   트렌드 주목해야 ,Economy
536, 기대 가  실망 으로 현물     승인 후 비트코인     이상 급락,Economy
537, 이제 목욕도 못하겠네   만원 넘긴 이용료에 서민  한숨 ,Economy
538,고금리  미분양 우려에 무너지는 지역건설사,Economy
539, 원자력 발전  우진엔텍  상장 첫날 날았다 올해 첫  따따블  핫종목 ,Economy
540, 하이트진로  출고가 인상 긍정적  분기 호실적 전망  한국,Economy
541,올해 첫 공모주 우진엔텍  코스닥 상장 첫날  따따블 ,Economy
542,현대건설  지난해 영업이익     억원 전년        ,Economy
543,하이비젼시스템    억 규모 자사주 취득 신탁계약,Economy
544,넷플릭스 가입자 급증 국내 영상 콘텐츠주 강세,Economy
545,현대카드  가수 장범준과 암표 없는 공연 만든다,Economy
546, 조선  올해 암모니아선 휩쓸었다   척 전량 수주,Economy
547, 수수료 무료  통했다 토스뱅크 외화통장  일 만에   만좌 돌파,Economy
548, 유동원의 투자전략    년전 아베의 유산 천장 뚫은  증시  왜 잘 나가나,Economy
549,셀트리온    우시   와     역량 강화   개 신약 개발 순항 ,Economy
550,  운용   미국나스닥         순자산     억 돌파,Economy
551,건설업계 불황 어디까지 올해 벌써 건설사   곳 법정관리 신청,Economy
552, 탈 메리츠  나선 롯데건설  시중은행과    조 펀드 조성 임박,Economy
553, 태영  부동산    위기 따른 하도급 업체 보호 시급 ,Economy
554, 크래프톤  올해 감익 리스크에도 신작 흥행 가능성  목표가  ,Economy
555,경기 국민평형 아파트 분양가   년 새  억 올라,Economy
556, 속보  한국 등   개국  미 영 후티 추가공습 지지 성명,Economy
557, 종합   분기 만에 흑자 전환              경쟁력 강화 ,Economy
558,하이퍼 럭셔리 아파트  포제스 한강        순위 청약,Economy
559,코스피  실적시즌 경계감에 하락 출발 외국인 기관  팔자 ,Economy
560,  편한세상 용인역 플랫폼시티  단지 내 상가   월   일 입찰,Economy
561, 정류장앞 역세권       가치 선점해볼까,Economy
562,  디스플레이  작년  분기 영업익     억,Economy
563, 애플 전기차 출시      년에나 가능 ,Economy
564,삼성전자     신제품           출시 성능 가격 다 잡았다,Economy
565,설 차례상 비용  또 역대 최고치 전통시장  비교적 저렴 ,Economy
566, 잠만 자도    만원  시몬스  꿀알바  모집에  만명 몰려,Economy
567,원 달러 환율  미국 국채금리 상승에 오름세      원대 후반,Economy
568,오늘의집   청소 설거지 빨래 가전 거래액 급성장 ,Economy
569,코스닥  개인 순매수 속 강보합세 출발,Economy
570, 해외 소송 비용 발생 등으로  분기 하회  현대건설 목표가 ,Economy
571, 평생 무료 환전  토스뱅크 외화통장 출시  일 만에   만좌,Economy
572,잠만 자도    만원    만명 몰린  이색 알바  뭐길래,Economy
573,택배사 택배기사노조 직접 교섭  분수령    일  심 선고,Economy
574, 쓰론앤리버티 게임 드라마틱한 반등 어려워  엔씨소프트 목표가 ,Economy
575,시몬스  시급    만원  겨울잠 알바 에  만명 몰렸다,Economy
576,자율주행 전기차 애플카 출시 또 지연   빨라야     년 ,Economy
577,우진엔텍  상장 첫날  따따블  직행,Economy
578,지금은 부동산  수요대책 이 필요합니다  더 머니이스트 심형석의 부동산정석 ,Economy
579,이닉스  공모주 청약  일차 마감    균등 배정 주식수는 ,Economy
580,이닉스  공모주 청약  일차 마감    균등 배정 주식수는 ,Economy
581,농심 신라면      년 사상 최대 매출  조    억원 달성,Economy
582,코스피  외국인 기관 매도   장 초반     선 약보합 출발,Economy
