,titles,category
0,셀트리온    시밀러 출시 가속페달   년  종  년  종 ,Economy
1,설 차례상 물가 역대 최고치  또  경신   만   만원,Economy
2,진양곤 회장      년 간암 치료제 시장점유율     매출  조 목표 ,Economy
3,스튜디오삼익  공모가  만    원 확정 경쟁률    대  ,Economy
4, 새해 첫 상장  우진엔텍   따따블  성공했다  증시이슈 ,Economy
5, 단독 롯데쇼핑  수원 영통에   층 시니어 레지던스 짓는다,Economy
6,수도권 부촌 관통하는 신분당선  수원 이목지구 지날까     디에트르  분양 소식 눈길,Economy
7,단통법 폐지되면 갤럭시     진짜  싸질까  반응은  글쎄 ,Economy
8, 김대호의 경제읽기  벼랑 끝 내몰린 건설업계 부도 분양보증 사고 급증,Economy
9, 카카오의   엔터 인수        년 자본시장 가장 뜨겁게 달군 이슈  넘버스 ,Economy
10,작년 폐기된 돈 얼마길래 쌓아보면  에베레스트산   배 ,Economy
11, 무등의 아침   강기정 시장  중앙공원  지구 선분양 입장 선회 치솟는 분양가는 결국 시민 부담 ,Economy
12, 자사주 취득 줄고  소각 늘고    셀트리온 취득  위  권영훈의 증시뉴스      ,Economy
13,내일부터 청년희망적금 청년도약계좌 연계가입  중도해지 해도 비과세 ,Economy
14, 발길이 떨어지질 않네   스타필드 수원    고객 잡을까 르포 ,Economy
15,스튜디오삼익  공모가  만    원 확정 희망밴드 상단 초과,Economy
16,쎌바이오텍  올해 대장암 치료제 임상 상     승인 목표 ,Economy
17,올해 첫 상장 우진엔텍  따따블      증권  연타석 흥행 기록,Economy
18,김주현도 증권사    에 쓴소리    위탁매매 부동산 중심 영업관행에서 벗어나야 ,Economy
19, 할인 불가 외담대 만기까지 늘려  태영 납품업체들  돈맥경화 ,Economy
20, 소액생계비 받으러 갔다가 취업까지  금융 고용 복합지원 나선다,Economy
21, 실패하면 책임 물을 것  이복현 경고장에 증권사      초긴장 ,Economy
22,스튜디오삼익  공모가 상단 초과  만    원 확정   일부터 일반청약,Economy
23,   세권 에는 이유가 있다  다세권 아파트  흥행 ,Economy
24,기대인플레   개월 만에 최저     금리 하락  기대도 쑥 ,Economy
25,대한전선  해저케이블 사업 해외 생산공장 인수에  조원 투입,Economy
26,대출 고용 잇는다 서민금융 이용자   만명에 일자리 지원,Economy
27,금감원장     리스크 관리 실패 시 엄중 책임 물을 것 ,Economy
28, 단독    곳 중  곳 적자  부실채권율 은행의   배     등급 금고도 안심 못해,Economy
29,서민금융 이용자   만명에 일자리 연계  월부터 복합 지원 개시,Economy
30,서민금융 이용하고 일자리도 챙긴다    만명 고용연계 ,Economy
31,청년희망적금 만기 도약계좌 갈아타기 내일부터  신청 ,Economy
32,서민금융 대출시 일자리 상담까지  금융 고용 한꺼번에 지원 ,Economy
33,단통법 전    조  영업익  조 시대 저물 수도 ,Economy
34,광주 전남 건설업계 벼랑끝 위기  곳 또 법정관리,Economy
35,셀트리온  우시    와     신약 개발 맞손   개 품목      ,Economy
36,호화 이사회 논란에도 포스코     후추위   숏리스트  후보군 확정,Economy
37,넷플릭스 가입자 수 깜짝 증가에 영상 콘텐츠  강세  증시이슈 ,Economy
38,현대카드  가수 장범준 공연 티켓 전량    로 발행  암표없는 공연 만든다 ,Economy
39, 역대급  복합쇼핑몰이 온다 스타필드 수원   일 그랜드오픈 종합 ,Economy
40, 단독    억 분양 강남 집이 반지하였다    억 비싼  층 테라스에 무슨일이   부동산    ,Economy
41,경계현 사장  모든 곳에    근본 변화 대응에 최선 ,Economy
42, 가동할수록 손해  석유화학 불황에    공장 존재감 타격,Economy
43, 중대재해법      정부 중소기업계 유예 한목소리,Economy
44,분양가 계속 오른다   지금이  타이밍 ,Economy
45, 마켓      파산신청  남발에 멈춰선 코스닥 상장사 제도 악용하는 세력 등장,Economy
46,에코프로머티 바닥 찍고 반등하나  거래일 만에 상승세,Economy
47,     초대형 컨테이너선  가닛호  명명식 다음달 미 항로 투입,Economy
48,토스뱅크 외화통장  출시  일 만에   만 좌 돌파,Economy
49,      만       급 컨선      가닛호  명명식,Economy
50,이복현 금감원장  새 살 돋으려면 굳은살 벗겨야 ,Economy
51,전체 교통요금은 올리고 일부 사용자만 환급   이미연의 발로 뛰는 부동산 ,Economy
52, 줄파산  악몽이 또 하도급 업체  돈 못 받았다  태영건설  후폭풍 ,Economy
53,     차   인터넷은행    조원 전세대출 대환서 시중은행과 한판승부,Economy
54,공정위  플랫폼 독과점시 경쟁질서 회복 불가능 국내기업 역차별  거짓뉴스 ,Economy
55,저축은행 연체채권 매각채널 확대  연체율 관리 개선 ,Economy
56,이복현  부동산    굳은살 벗겨내야  건설 금융사 노이즈 감내 ,Economy
57,검찰   흉기로 아내 살해   대 징역   년 너무 가볍다  항소,Economy
58,디파이      달새         억 달러도  터치 ,Economy
59,판매 부진 제네시스  해외 브랜드 맞설 전기차 출시는 언제 ,Economy
60,카카오톡  대리인 지정  추모 프로필   고인 대화 내용은 비공개 ,Economy
61,불타고 썩은 화폐    조 원 롯데월드타워    배,Economy
62,이베이  직원      명 감원 소식에 시간외 급등,Economy
63,제테마 필러 수출  톡신시판 덕 매출 급성장세,Economy
64,흑자전환  이그니스   코스닥 상장 추진 하나증권 주관사 선정,Economy
65, 단독 조산화아연 제조  황조  매물로   마켓워치 ,Economy
66,현대위아  지난해 유럽 북미 업체   조원  규모 등속조인트 공급계약,Economy
67,역시 답은      경쟁력       분기 만에  적자 늪  탈출,Economy
68,반도체 장비주 신고가 축포 속 증권가      관련주 옥석 가려야,Economy
69,    글로벌 항암신약  봄을 기다린다 ,Economy
70,기관  이차전지에 울고   에 웃고,Economy
71,청년희망적금 청년도약계좌 연계 가입 내일부터 접수,Economy
72,증권사    에 목소리 높인 이복현 금감원장    리스크 관리 실패하면 책임 묻겠다 ,Economy
73, 피곤할 때 한잔  마셨더니 불면증 시작   숙면 위해선 피해야할  음료 ,Economy
74,태영건설 워크아웃 후 하도급 피해   곳서 대금미지급 발생,Economy
75,지난해 폐기된 화폐 쌓으면 에베레스트산   배,Economy
76, 잠만 자도    만원 준대    만명 몰린  겨울잠  꿀알바,Economy
77, 일     시간  잔업 도 합법이 된 세상  아카이브 ,Economy
78,봄 오기   움직여야 할 때  영통역자이 프라시엘    일부터 당첨자 계약 관심,Economy
79,이경규 장도연  출연료 미지급  기획사 대표 횡령 혐의로 집유,Economy
80,아캄      현물     온체인 주소 공개,Economy
81, 단독 저출생에 집  만개 준다던 정부  달랑     만 지급  인구전략 ,Economy
82,엔케이맥스  회사 내부적 주가 급락 사유 없어  악성 루머에 대응 ,Economy
83,명품 플랫폼  쿠팡 쓱을 막아라   새 전략  짜기 안간힘,Economy
84,키움운용          반도체      연초 수익률  위,Economy
85,  디스플레이 유상증자 단행    차 발행가액  만  원,Economy
86,금융당국 수장들 증권사 질타     관리 실패시 책임 묻겠다  종합 보 ,Economy
87,한올바이오파마  작년 매출  천   억  년 연속 최대,Economy
88, 뉴스  뉴스     월의 월급 최대로   실수 없이 챙기는 연말정산 비책은 ,Economy
89,상장사 지난해 자사주    조원 태웠다 신한지주 현대차 최대,Economy
90,내일부터 청년희망적금 청년도약계좌 연계 가입 신청,Economy
91,주식 매집 후  매수하라  의견 부당이득 증권사 직원  실형에 항소,Economy
92, 거래 절벽  만  천여 개 공인중개사 문 닫아 ,Economy
93,  월 출생아 연중 최저치 기록   인구감소 만  년 넘어,Economy
94,공정위  플랫폼법 국내기업 역차별은 오해 독점화 막으려면 대응 필요 ,Economy
95,  월 출생아 또 역대 최저   인구   개월째 자연감소,Economy
96, 일문일답 공정위  플랫폼법   사전규제  아냐 국내외 구분 안해 ,Economy
97,저축은행 연체율 우려에 개인사업자 연체채권  캠코에 팔 수 있다,Economy
98,셀트리온  중국 우시 와 신약개발과 위탁생산 협약 체결,Economy
99,올해 설 차례상 비용  역대 최고  전통시장   만 원,Economy
100, 로봇청소기 식기세척기 의류건조기   대 가사 해방 가전 급성장,Economy
101, 강달러  속 당국 개입 경계 장중 환율      원대 저항 외환분석 ,Economy
102,오상기 현대바이오 대표  다음 달 긴급사용승인 윤곽 나올 것 ,Economy
103,코스피 코스닥  약보합세 포스코인터내셔널    ,Economy
104,  조원 기부왕  회장님의 불편한 진실 결국 전직원  해고 ,Economy
105,공유 이효리도  엄빠  공감 노린 키즈광고 못 이겼다,Economy
106,소비심리 회복세  집값 더 떨어질 것 ,Economy
107,엔케이맥스  내부 주가 급락 사유 없다 ,Economy
108,  조 나트륨이온배터리 시장 열린다     보다     저렴 ,Economy
109, 역대급  초대형 쇼핑몰 스타필드 수원    일 정식 개장,Economy
110,   억원대 유전성 망막위축 치료제 급여화  환자부담     만원으로   ,Economy
111,한 단계 진화한  스타필드 수원  오는   일 개장,Economy
112,수원에 스타필드         의 신세계  연다,Economy
113,   저축은행 연체율 비상 부살채권 매각채널 확대한다,Economy
114,한올바이오파마  지난해 매출     억  영업익   억 기록,Economy
115,작년 손상화폐  조    억원 폐기 롯데월드타워    배 높이,Economy
116,땅에 묻어놨던     만원어치 지폐  은행 가져갔더니   강진규의    워치 ,Economy
117, 불에 타고 물에 불어  지난해 버려진 화폐만  조원,Economy
118,수원에 고소득    직장인들 많다더니  정용진 야심작  떴다  영상 ,Economy
119,  월 출생아 수  사상 처음  만  천 명대로 추락,Economy
120,홍콩 항셍지수      상승세 마윈  알리바바 주식 매입 호재,Economy
121,    만 고객 시간 점유할 것  스타필드 수원  그랜드 오픈,Economy
122,   대  저축은행 연체율에  당국  매각채널 늘리고 채무조정 활성화 ,Economy
123,저축은행 부실채권 시장 매각 허용    옥석가리기 속도낸다,Economy
124, 단독  이우현     회장  한미약품 원하면 언제든 대화   동남아 시장 염두,Economy
125, 아기 울음소리 뚝    월 출생아 수  첫    만명대 역대 최저,Economy
126, 어음 발행 임금체불  태영 하도급   개 현장서 직간접 피해,Economy
127,더 가팔라지는  인구절벽   개월째 출생아  만명대  뚝 ,Economy
128,저축은행 개인사업자 연체채권 매각  캠코     전문사로 확대,Economy
129,다음달부터 자영업자 연체채권  캠코에 팔 수 있다,Economy
130,    배 줌 으로 놀래킨 갤럭시 조성대 부사장  갤    카메라     집결체 ,Economy
131,땅값 상승률   년 이후 최저    반도체 호재  용인 처인구 만 급등,Economy
132,성수 홍대 비켜 정용진 신년 첫 야심작  스타필드 수원      만명 꽉 잡는다,Economy
133,   년생   만원권 수명 다해가나 지난해 손상화폐       급증,Economy
134,  월 출생아 수 또  같은 달 기준 역대 최저  사망자 수는  ,Economy
135, 억원대 유전성 망막위축 치료제 럭스터나  건강보험 적용,Economy
136,지난해 폐기된 화폐 쌓으면 에베레스트산   배,Economy
137,지난해 손상 화폐  억  천만 장 폐기 에베레스트 높이   배,Economy
138,저축은행 개인사업자 연체채권  캠코    투자사에도 매각한다,Economy
139,저축은행 연체채권 캠코로 매각 가능 저축은행 한숨돌리나,Economy
140,저축은행 연체채권 캠코로 매각 가능 저축은행 한숨돌리나,Economy
141, 단독 이우현     회장  한미약품과    는 통합 아닌 협력 모델 ,Economy
142,신세계도  참전  유통가 최대 격전지  경기 남부 ,Economy
143,인구   개월째 줄었다   월 출생아  만 천명 대  역대 최저 ,Economy
144,    억     만원  내달부터 약값 확 싸지는  가지 신약 무엇 ,Economy
145,땅에서 썩고  불타고 작년 폐기화폐  롯데타워    배 높이 ,Economy
146, 개월 이상 연락두절된 자영업자 부실채권  민간 매각 허용,Economy
147,  개발 나트륨배터리  게임체인저 되나     보다 최대     저렴 ,Economy
148, 최적의 입지  시흥시청역 여의도 판교 김포공항 연결하는 트리플 역세권,Economy
149,갤럭시 차기         성능 관심  나노  세대  출격  기대감,Economy
150,증권사     만난 이복현     리스크 관리 실패시 책임 묻겠다  종합 ,Economy
151,중국선 아이폰 사랑 식고 전 세계선  중고폰  강세,Economy
152,현대차그룹 내 존재감 약해지는 현대제철 서강현 미션은 ,Economy
153,민생 외치더니 국회는 정쟁  정부는 방기   중기인 범법자 양산할 판 ,Economy
154,챗   의 러브콜      수율     삼성  투자 ,Economy
155, 신년 기획  축구장    개 크기 초대형 합작조선소        완공땐     척 선박 생산,Economy
156, 신년기획 사막 위에 강철 기자재 공장  한국  중동 탈석유 기반 다진다,Economy
157,한국이 뿌린 제조업 씨앗  사우디  흥분 감출 수 없어   한 중동  석유없는 미래  준비한다 ,Economy
158, 일 남은 중처법  국회  끝내 손놓나,Economy
159,공급 가뭄에 신축 이전 수요 탄탄  공주월송지구 경남아너스빌  이목 집중,Economy
160,홍해 긴장에  중동 에너지  로 운반  하루 운임      급등,Economy
161,토스뱅크 외화통장  출시  일 만에    만좌  돌파,Economy
162,태영    사업장에     억원 추가투입  암초   숨겨진 부실 드러날까,Economy
163,증권사 수장들 만난 이복현 금감원장  부실   사업장 신속 과감한 정리를 ,Economy
164,소비심리지수           개월 만에  낙관 우세 로 전환,Economy
165, 단독  신협  또 조합 돈  천만 원  꿀꺽 ,Economy
166, 급전창구  부담 커지네 보험사 신용대출 금리도  껑충 ,Economy
167,정부  중대재해법 유예 거듭 요청  기업들 준비 기회 달라  종합 ,Economy
168,조선  빅  는 이제 옛말    한국조선해양  연초부터 수주 독주,Economy
169,미 영 예멘 공습 이후 중동 아시아 연료 운송비      폭증,Economy
170,현대건설     년 영업이익     억원 전년         ,Economy
171,   에 영화기금 부과금 검토   재검토 지시에 협의  난망  종합 ,Economy
172,내일부터 청년희망적금 청년도약계좌 연계가입 신청 개시,Economy
173,증권사     소집한 김주현 이복현  리스크 관리 실패    에 책임 ,Economy
174, 월 이후 입국 외국인   개월 이상 체류해야 건강보험 혜택,Economy
175,영세기업 곡소리 전면화 앞둔 중처법  막판 유예 촉구,Economy
176,비수도권 청약경쟁률         단지 공통점  직주근접 ,Economy
177,이벤트 부재 속 금리 인하 재평가 구간 지속 채권분석 ,Economy
178,내일부터  청년도약계좌  연계가입 시작  일시납입 가능 ,Economy
179,정말  부양책  나올까 홍콩증시 연이틀 급등세      오전 ,Economy
180, 감세  또 감세 에   재정 악화할 뿐    성장 위해 필수  논란,Economy
181, 올라도 너무 올라  올해 설 비용  역대 최고  전통시장   만원,Economy
182,넷피아  구글 애플에 자사 검색엔진 탑재 요청,Economy
183, 실적 악화 호화 의전  위기의 포스코  오늘 차기 회장후보 쇼트리스트 확정,Economy
184,롯데월드타워 몰  지난해     만명 찾았다  역대 최다 ,Economy
185, 고물가  끝날까   년 후 물가전망   개월 만에 최저,Economy
186, 평생 수수료 무료  토스뱅크 외화통장  출시  일 만   만 좌 돌파,Economy
187, 별 보러 가자   아    들  괴롭힘 성희롱 난무 삼바 고용부 적발,Economy
188,금융위  내일부터  청년도약계좌  연계 가입 신청 개시,Economy
189,코스피  외인 기관  팔자  속 하락세 실적 발표 앞 경계감,Economy
190,경영 불확실성에 대기업들 잇달아 사장단 회의 개최,Economy
191,제일건설   제일풍경채 검단  차  전 타입   대  로  순위 마감,Economy
192, 짝퉁 명품  당장 버리세요  발암물질 최대    배 검출 ,Economy
193,올트먼 만나는 경계현 사장    발 근본적 변화 삼성 반도체로 충족 ,Economy
194,온라인 자동차 판매 시작한 아마존 성공  실패 ,Economy
195, 값 역대 최고  더 오른다  금테크 잘하려면,Economy
196,공정위  플랫폼법  역차별 은 거짓뉴스 정부안 상당히 진전 ,Economy
197,카카오  추모 프로필  기능 강화 카톡에 마지막 편지 남긴다,Economy
198, 마켓인  노선 강화  에어프레미아   파트너스  자금 투입 카드 만지작,Economy
199,코스피  외인 기관  팔자 에 하락 대형   반도체주  와르르 ,Economy
200,김주현 이복현  증권사 역할 강조     부실    에 책임 묻겠다 ,Economy
201,현대건설  국내 부동산 암흑기  매출보다 빛난 수주 ,Economy
202,작년 미국 노조원 비율      턱걸이      년 이후 최저 경신,Economy
203,태영건설 워크아웃 신청 후   곳 피해     발주자가 대금 직접 줘야 ,Economy
204, 사채라도 써야할 판   금융권 대출  빙하기 ,Economy
205, 년만에 풀체인지   클래스   벤츠       딱 기다려  ,Economy
206,강인한 앞모습  단단한 승차감에 끌리다  김성우의 시승기 기아 더 뉴 쏘렌토 ,Economy
207,마트 단팥빵  앙금 비중 알아봤더니 최강자는   푸드    ,Economy
208,소액대출에 미래 저당잡힌 청년들  이슈 뷰 ,Economy
209,이수만이    판 돈으로 산 파블로항공 상장앞두고 소송잡음,Economy
210, 대한민국 국민이 한번 이상 방문한 이 곳은  ,Economy
211,수술 회복     기 체제  맞는 삼성 준감위 과제는,Economy
212,김주현 이복현  증권사 영업행태 질타     리스크 챙겨라 ,Economy
213,암표 없앤다 장범준 공연에     티켓 등장,Economy
214,강북 재개발 대어급  이문 구역   월 관리처분 눈앞,Economy
215,강남불패마저 깨졌다   하락 거래 속출,Economy
216,첫 단추부터 잘못 끼워진 사전청약  박일한의   피아 ,Economy
217,  억 트리마제   억     만원 에 매입한 김지훈  비결은,Economy
218,친구에게 가장 많이 주는 선물은 화장품 직장동료 연인에게는 ,Economy
219, 낙폭 과다  삼성전자 순매수  위  주식 초고수는 지금 ,Economy
220,시급    만원  겨울잠 알바 에  만명 몰렸다,Economy
221,수출효자 샤인머스캣  종주국   넘는다,Economy
222,공정위  플랫폼법 역차별 우려는 가짜뉴스   제정 못하면  역사의 죄인  ,Economy
223,  엔비디아  모색하는 오픈   올트먼 삼성   와   반도체 손잡나,Economy
224,농협중앙회장 선거      직선제   강 각축전,Economy
225,카카오   추모 프로필  기능 강화 카톡으로 마지막 편지 남긴다,Economy
226, 술 아껴 마셔야 하나  마트서 맥주      올랐는데 식당서는             이후 최고,Economy
227,  년 만에 외국인 전용 카지노 인천 인스파이어에 문 연다,Economy
228,  디스플레이   분기만에 흑자 전환,Economy
229,이복현 금감원장  증권사  리스크 관리의 기본을 잊지 말아야 ,Economy
230,  초에   개 팔렸다  신라면 지난해 매출    조  사상 최대 ,Economy
231,롯데월드타워 몰 방문객 지난해     만명 역대 최다,Economy
232,상장 앞둔 케이웨더   공기지능 환기청정기  아파트 만세대 규모 수주  투자    ,Economy
233, 이승원의 기후             트럼프가 온다  지구는 두렵다 ,Economy
234,이복현     리스크 관리 실패 책임 엄중히 묻겠다  연일 압박,Economy
235, 준비 기회 달라  중대재해법 유예 호소 나선 장관들,Economy
236, 중처법      오영주  범법자 양산 가능성  김기문  극적 합의 기대 ,Economy
237,셀트리온      신약개발 속도 낸다,Economy
238, 초호화 이사회 로 수사 대상된 포스코 후추위   내 갈길 간다    일 숏리스트 확정,Economy
239,     초과  중대형 경쟁률   대  전년     배 올라,Economy
240,셀트리온      신약개발 속도 낸다,Economy
241, 초호화 이사회 로 수사 대상된 포스코 후추위   내 갈길 간다    일 숏리스트 확정,Economy
242,     초과  중대형 경쟁률   대  전년     배 올라,Economy
243,태영건설 워크아웃 여파  하청업체 현장     직간접 피해 발생,Economy
244,부양 기대감 먹혔나  중국 증시 상승세  지수   대 ,Economy
245, 과일  채소 안 오른 게 없네  설 차례상 비용도  역대 최고 ,Economy
246,전국 땅값 주춤했지만 반세권은  들썩 ,Economy
247,시몬스   시급    만원  수면 패턴 진단 아르바이트에  만명 몰려,Economy
248,농심  신라면   지난해 매출  조     억원 기록,Economy
249, 아이폰 고마워  엘지디스플레이   분기 만에 흑자전환,Economy
250,코스닥  외국인 기간 매도 속 약세    선 턱걸이,Economy
251,     세종역 신설은 균형발전 저해  충북 이어 충남서도 비판,Economy
252,김주현 이복현  금투업계  증시 저평가 해소 신뢰 회복 위해 노력해야  종합 ,Economy
253,테슬라보다    가 먼저  키       인간형 로봇  공장 투입,Economy
254, 헤럴드광장  반복되는 부동산    부실  무엇이 문제일까 ,Economy
255, 셀아시아  찬바람에 환율 고공행진,Economy
256,열에 아홉은 뉴욕장   해외주식  미국 편식  역대 최대  글로벌 머니 무브 ,Economy
257,  대선 트럼프 우세 삼성   하닉 달갑지 않은 이유는 ,Economy
258,     일 만에 또 도발   서해 순항미사일 여러 발 발사  권영훈의 증시뉴스      ,Economy
259, 제주도  만원 일본  만원  할인 항공권 쏟아진다,Economy
260,나주혁신도시 오피스텔    채로 갭투자 전세 사기,Economy
261,카타르 도하서 선보인 한국정원 인기 현지인 관광객 탄성,Economy
262,이차전지주 올들어 시총     증발,Economy
263,대한항공 아시아나 합병 윤곽  산은  일석이조  기대감,Economy
264, 못 갚으면 주변에 공개  청년 옥죄는     사채업자들  미래를 저당잡힌 청년들  상  ,Economy
265, 년 만에 늘어난 채무불이행자   대 청년 가파른 상승세 뚜렷  미래를 저당잡힌 청년들  상  ,Economy
266,거꾸로 가는 카드론 금리   은행 대출금리 하락에도 역행하는 까닭,Economy
267,금융당국  증권사 사장단 향해 엄중 경고  리스크 관리 실패      책임 ,Economy
268,   년 기술 노하우  현대위아  등속 조인트 해외 수주  잭팟 ,Economy
269, 임차인 보호  근본 대책은 정보 비대칭 문제 해결 ,Economy
270, 워크아웃  태영 하도급 피해 현실화 현장   곳서 직간접 피해,Economy
271, 구글    네이버 카카오 배민  독점   플랫폼법 놓치면 역사의 죄인 ,Economy
272, 부채 덩어리  한전  임직원에 삥 뜯어 퇴직위로금 마련    그럼에도 올해    명 채용  강홍민의 끝까지 간다 ,Economy
273,      만       급 컨테이너선      가닛호  명명식 개최,Economy
274,키움운용         글로벌  반도체      연초 수익률  위,Economy
275, 반도체의 힘    용인 처인구 땅값 상승률  위,Economy
276,오징어게임 최후의  인 돼 볼까  넷플릭스 출연 기회도,Economy
277,    초대형 컨테이너선  가닛호  명명식  남산타워보다 높다 ,Economy
278,허경영도  문어발 경영   불로유 논란에도 음료 주류사업 나선다,Economy
279,한파 뚫는 내집마련 열기   영통역자이 프라시엘    일 당첨자 계약 돌입,Economy
280,     만 천   급 컨테이너선  가닛호  명명식 내달  항로 투입,Economy
281,짜장면 값도  배 가까이 뛰었는데 작년 전국 땅값   년 만에 최저 변동률  부동산    ,Economy
282,신라면   초에   개씩 팔렸다 지난해    조원 매출  역대 최대 ,Economy
283, 빙하기 지속  글로벌 벤처투자 작년 투자규모도 건수도  최저치 ,Economy
284,삼성     최적화     출시  낸드의 봄  앞당긴다,Economy
285,약물 취해 인도 돌진  압구정 롤스로이스    대   심 징역   년,Economy
286,찜질방 목욕탕 요금        올라 목욕료 외환위기후 최대 상승,Economy
287,경기 분양가  년새   억  껑충  너무 비싸  그래도 인기 단지엔 몰렸다,Economy
288,  시간 잠만 자면    만원 드려요     만명 몰린  꿀알바 의 정체,Economy
289,로이터  이코노미스트         월에 미 금리 인하 시작 ,Economy
